200,15295997,https://www.airbnb.com/rooms/15295997,20241228025327,2024-12-28,previous scrape,Spacious 2BR Apt | Washer/D | Panoramic Views,"Design and sophistication describe this apartment and the Kendall Square area. Leading academic institutions like MIT, innovative restaurants with all types of cuisine, a big selection of shopping centers, and the proximity to the Kendal/MIT metro make this apartment your perfect headquarters to explore Cambridge and Boston. Enjoy the panoramic views from your home, its spacious floor plan, the designer kitchen, and oversized windows and closets. This top-notch community next to the Charles River offers a modern fitness center, concierge services, a Zen garden, a lush clubhouse, and a sundeck.","This community is located in Kendall Square which has become one of the most exciting places to visit with endless options for dining, entertainment, shopping, recreation and more.     CambridgeSide Galleria Mall  0.6 miles  Massachusetts Institute of Technology  0.4 miles  Harvard University  1.9 miles  Harvard Museum of Natural History  2.2 miles  Cambridge Common 2.5 miles",https://a0.muscache.com/pictures/prohost-api/Hosting-15295997/original/1bd82119-ba8d-4dfa-9ebb-16f88ff367cd.jpeg,95459395,https://www.airbnb.com/users/show/95459395,Bluebird,2016-09-16,,"You’ve just found the best of both worlds. Bluebird Suites provides deluxe apartments with fast, free Wi-Fi, a full kitchen, living room and dining area located in 5-star buildings in the heart of the city. No matter how long you plan to stay we want you to have an amazing experience and leave with a smile.  
Looking Forward to hosting you!!

Yos and the Bluebird Suites team

",within an hour,63.0,98%,f,https://a0.muscache.com/im/pictures/user/4fbdbede-6015-43df-9e27-c1e5b31f7cfa.jpg?aki_policy=profile_small,https://a0.muscache.com/im/pictures/user/4fbdbede-6015-43df-9e27-c1e5b31f7cfa.jpg?aki_policy=profile_x_medium,Hell's Kitchen,201,996,"['email', 'phone', 'work_email']",t,t,Neighborhood highlights,East Cambridge,,42.363747,-71.083374,Entire serviced apartment,Entire home/apt,5,,2 baths,2.0,,"[""Paid parking on premises"", ""Essentials"", ""Wifi"", ""Ethernet connection"", ""Building staff"", ""Self check-in"", ""Elevator"", ""Bed linens"", ""Freezer"", ""Conditioner"", ""Window guards"", ""Carbon monoxide alarm"", ""Cleaning products"", ""Heating"", ""Stove"", ""Coffee"", ""Body soap"", ""Pets allowed"", ""Dryer"", ""Shower gel"", ""Dining table"", ""Wine glasses"", ""Smoke alarm"", ""Baking sheet"", ""Toaster"", ""Hot water"", ""Refrigerator"", ""Oven"", ""Crib - available upon request"", ""Dedicated workspace"", ""Hangers"", ""Coffee maker"", ""Paid parking off premises"", ""Dishes and silverware"", ""Blender"", ""Shampoo"", ""Dishwasher"", ""Extra pillows and blankets"", ""Hot water kettle"", ""Long term stays allowed"", ""Cooking basics"", ""Clothing storage"", ""Microwave"", ""Air conditioning"", ""Washer"", ""TV"", ""Iron"", ""Exercise equipment"", ""Hair dryer"", ""Kitchen""]",,30,1125,30,30,1125,1125,30.0,1125.0,,t,29,59,89,364,2024-12-28,4,0,0,2017-01-18,2023-07-08,4.75,5.0,5.0,4.75,4.75,5.0,5.0,C0281180491,t,6,6,0,0,0.04
201,15369556,https://www.airbnb.com/rooms/15369556,20241228025327,2024-12-28,previous scrape,Private & Clean 2BR Apt | Gym | East Cambridge,"Design and sophistication describe this apartment and the Kendall Square area. Leading academic institutions like MIT, innovative restaurants with all types of cuisine, a big selection of shopping centers, and the proximity to the Kendal/MIT metro make this apartment your perfect headquarters to explore Cambridge and Boston. Enjoy the panoramic views from your home, its spacious floor plan, the designer kitchen, and oversized windows and closets. This top-notch community next to the Charles River offers a modern fitness center, concierge services, a Zen garden, a lush clubhouse, and a sundeck.","This community is located in Kendall Square which has become one of the most exciting places to visit with endless options for dining, entertainment, shopping, recreation and more.     CambridgeSide Galleria Mall  0.6 miles  Massachusetts Institute of Technology  0.4 miles  Harvard University  1.9 miles  Harvard Museum of Natural History  2.2 miles  Cambridge Common 2.5 miles",https://a0.muscache.com/pictures/prohost-api/Hosting-15369556/original/d1aafdb1-6651-4abd-a154-114ca3c0001b.jpeg,95459395,https://www.airbnb.com/users/show/95459395,Bluebird,2016-09-16,,"You’ve just found the best of both worlds. Bluebird Suites provides deluxe apartments with fast, free Wi-Fi, a full kitchen, living room and dining area located in 5-star buildings in the heart of the city. No matter how long you plan to stay we want you to have an amazing experience and leave with a smile.  
Looking Forward to hosting you!!

Yos and the Bluebird Suites team

",within an hour,63.0,98%,f,https://a0.muscache.com/im/pictures/user/4fbdbede-6015-43df-9e27-c1e5b31f7cfa.jpg?aki_policy=profile_small,https://a0.muscache.com/im/pictures/user/4fbdbede-6015-43df-9e27-c1e5b31f7cfa.jpg?aki_policy=profile_x_medium,Hell's Kitchen,201,996,"['email', 'phone', 'work_email']",t,t,Neighborhood highlights,East Cambridge,,42.363747,-71.083374,Entire serviced apartment,Entire home/apt,5,,2 baths,2.0,,"[""Paid parking on premises"", ""Essentials"", ""Wifi"", ""Ethernet connection"", ""Building staff"", ""Self check-in"", ""Elevator"", ""Bed linens"", ""Freezer"", ""Conditioner"", ""Window guards"", ""Carbon monoxide alarm"", ""Cleaning products"", ""Heating"", ""Stove"", ""Coffee"", ""Body soap"", ""Pets allowed"", ""Dryer"", ""Shower gel"", ""Dining table"", ""Wine glasses"", ""Smoke alarm"", ""Baking sheet"", ""Toaster"", ""Hot water"", ""Refrigerator"", ""Oven"", ""Crib - available upon request"", ""Dedicated workspace"", ""Hangers"", ""Coffee maker"", ""Paid parking off premises"", ""Dishes and silverware"", ""Blender"", ""Shampoo"", ""Dishwasher"", ""Extra pillows and blankets"", ""Hot water kettle"", ""Long term stays allowed"", ""Cooking basics"", ""Clothing storage"", ""Microwave"", ""Air conditioning"", ""Washer"", ""TV"", ""Iron"", ""Exercise equipment"", ""Hair dryer"", ""Kitchen""]",,30,1125,30,30,1125,1125,30.0,1125.0,,t,29,59,89,364,2024-12-28,1,0,0,2018-10-05,2018-10-05,5.0,5.0,4.0,5.0,5.0,5.0,5.0,C0281180491,t,6,6,0,0,0.01
210,15929332,https://www.airbnb.com/rooms/15929332,20241228025327,2024-12-28,city scrape,Harvard/MIT (Unit 1)- Brooklyn Ambiance w/ Parking,"Central Square is known for its diversity, upscale, ethnic eateries and a vibrant club scene.  Easy walk to Central Square subway (3 min), MIT (12 min) and Harvard (15).   Our apartment offers parking for 1 large car, and a well-equipped kitchen for entertaining.",Central Sq. is hot!  Lots of great dining options.  Walking to either MIT or Harvard is very easy.  Cambridge is a bike friendly city.,https://a0.muscache.com/pictures/a554b2a4-4dc0-4da8-b420-a78094b316dc.jpg,35489146,https://www.airbnb.com/users/show/35489146,Ann,2015-06-10,"Cambridge, MA","I am an English teacher for new Americans own the two unit apartment building.    If unable to personally greet you, our two sons will be happy to assist you.  We live two miles away from this building.   We have developed an ""insider's guide to Cambridge"" to provide you with a solid foundation to enjoy your stay.  We frequently stay with Airbnb hosts when we travel.    I am member of two choirs and love history and literature.  ",within a few hours,100.0,98%,t,https://a0.muscache.com/im/pictures/user/19e6d8b2-e50c-493f-a4ac-3ae71c88a530.jpg?aki_policy=profile_small,https://a0.muscache.com/im/pictures/user/19e6d8b2-e50c-493f-a4ac-3ae71c88a530.jpg?aki_policy=profile_x_medium,,2,2,"['email', 'phone']",t,t,Neighborhood highlights,Mid-Cambridge,,42.36612,-71.1036,Entire rental unit,Entire home/apt,5,2.0,2 baths,3.0,5.0,"[""Essentials"", ""Wifi"", ""Free street parking"", ""Self check-in"", ""Bed linens"", ""Lockbox"", ""Carbon monoxide alarm"", ""Heating"", ""Stove"", ""Dryer"", ""Smoke alarm"", ""First aid kit"", ""Pack \u2019n play/Travel crib"", ""Free parking on premises"", ""Luggage dropoff allowed"", ""TV with standard cable"", ""Hot water"", ""Refrigerator"", ""Oven"", ""Dedicated workspace"", ""Hangers"", ""Coffee maker"", ""Dishes and silverware"", ""Shampoo"", ""Dishwasher"", ""Extra pillows and blankets"", ""Long term stays allowed"", ""Cooking basics"", ""Microwave"", ""Air conditioning"", ""Fire extinguisher"", ""Washer"", ""Iron"", ""Hair dryer"", ""Kitchen""]",$400.00,2,30,2,2,30,30,2.0,30.0,,t,0,22,52,122,2024-12-28,297,34,1,2016-11-27,2024-12-01,4.93,4.94,4.87,4.97,4.97,4.96,4.81,STR-19477,f,2,2,0,0,3.02
211,15930566,https://www.airbnb.com/rooms/15930566,20241228025327,2024-12-28,city scrape,"Spacious 2BR 2 bath, walk to Harvard & MIT","Welcome! This home is spacious and airy, with high ceilings and open floor plan.  Charming, historic house with all modern amenities: central A/C, stainless steel appliances, Wi-fi, and washer/dryer in unit. Complimentary coffee & tea. Quiet, residential street, yet close to everything: 10 min walk to Harvard,  20-30 min walk to MIT, bus or T (subway) to Boston (25 min). WholeFoods, restaurants, and shops around the corner, with lots more within 5-15 mins walk. Parking by arrangement.","We're on a  tree-lined, quiet, residential street with brick sidewalks and charming 100-year old wood houses, but walking distance to everything. Around the corner are several restaurants and cafés: Dali's (tapas), Kebob factory (Indian), Bergamot (American / fusion), The Thirsty Scholar Pub, Darwin's (sandwiches and baked goods - yum!) and the Biscuit (bakery and café). If you want to eat in,  get stuff around the corner at Wholefoods, The Wine and Cheese Cask, and Savenor's the butcher. A short walk away are lots more shops, restaurants and night life in Inman Square (5min), Harvard Square (10-15 min) and Union Square (5-10min). Harvard Art Museums 10 min, public library and pool 3-5 min walk.",https://a0.muscache.com/pictures/fcee75df-71f4-4fe5-ab2e-f053e6ac2841.jpg,6626676,https://www.airbnb.com/users/show/6626676,Kjersti,2013-05-28,"Cambridge, MA","Hi, I'm Kjersti, (yup, unusual name unless you're Norwegian - so I also answer to Kirsti or just K:).  I love to travel to places a bit off the beaten path. Closer to home I enjoy my kids, skiing, hiking, biking, Kung Fu, cooking, and spending time with  family and friends.  Looking forward to hearing from you! 
Best, 
Kjersti ",within an hour,100.0,100%,t,https://a0.muscache.com/im/pictures/user/df7f4598-039c-4187-9dba-9c3287ef1f93.jpg?aki_policy=profile_small,https://a0.muscache.com/im/pictures/user/df7f4598-039c-4187-9dba-9c3287ef1f93.jpg?aki_policy=profile_x_medium,Cambridge,1,1,"['email', 'phone']",t,t,Neighborhood highlights,Mid-Cambridge,,42.37734,-71.10705,Entire rental unit,Entire home/apt,6,2.0,2 baths,2.0,3.0,"[""Paid parking on premises"", ""Essentials"", ""Central air conditioning"", ""Ethernet connection"", ""Wifi"", ""Free street parking"", ""Self check-in"", ""Bed linens"", ""Freezer"", ""Conditioner"", ""Lockbox"", ""Carbon monoxide alarm"", ""Cleaning products"", ""Single level home"", ""Coffee"", ""Hammock"", ""Bathtub"", ""Shower gel"", ""Dining table"", ""Wine glasses"", ""Smoke alarm"", ""Baking sheet"", ""First aid kit"", ""Frigidaire Gallery (stainless steel) refrigerator"", ""Toaster"", ""Portable fans"", ""Hot water"", ""Children\u2019s books and toys for ages 0-2 years old and 2-5 years old"", ""Stainless steel stove"", ""Clothing storage: walk-in closet, closet, and dresser"", ""Dedicated workspace"", ""Hangers"", ""Coffee maker"", ""Central heating"", ""Dishes and silverware"", ""Blender"", ""Private entrance"", ""Shampoo"", ""Dishwasher"", ""Extra pillows and blankets"", ""Hot water kettle"", ""Shared patio or balcony"", ""Fire pit"", ""Long term stays allowed"", ""Free dryer \u2013 In unit"", ""Pack \u2019n play/Travel crib - available upon request"", ""Shower gel and hand soap. Brand varies.  body soap"", ""Cooking basics"", ""Microwave"", ""Shared backyard \u2013 Not fully fenced"", ""Books and reading material"", ""Outdoor furniture"", ""Fire extinguisher"", ""Free washer \u2013 In unit"", ""Board games"", ""TV"", ""Iron"", ""Frigidaire stainless steel oven"", ""Hair dryer"", ""Kitchen""]",$296.00,3,365,1,3,1125,1125,3.0,1125.0,,t,25,51,81,299,2024-12-28,291,48,2,2017-07-11,2024-12-09,4.96,4.99,4.99,4.98,4.99,4.97,4.86,STR-14648,f,1,1,0,0,3.2
228,18151308,https://www.airbnb.com/rooms/18151308,20241228025327,2024-12-28,city scrape,Beautiful Cambridge/Harvard house,"Steps from Harvard campus, Harvard Yard and Harvard square. Close to public transportation, restaurants and shops. Newly renovated large house of 1700 sq feet: quiet, bright, high ceiling, nicely decorated with antique furniture and art. Private Parking spot.<br />A/C. Fully equipped eat in kitchen.<br />3 Bedrooms (2 Queen size and 1 twin size beds 1). <br />2.5 bathrooms,  living room with dining area. Ideal for 3-5 guests.<br />Garden and patio, outdoor dining table and chairs. BBQ. Washer/Dryer.","Steps from Harvard yard (5 min. walk) and Harvard square. Close to restaurants and shops (the best butcher in Boston is one block, Whole Foods 10 min. walk).",https://a0.muscache.com/pictures/miso/Hosting-18151308/original/56e04bc5-5407-4c65-937a-693ba828a009.jpeg,5862063,https://www.airbnb.com/users/show/5862063,Federico,2013-04-10,United States,X,within an hour,100.0,97%,t,https://a0.muscache.com/im/pictures/user/ad16cb03-84f4-48e1-a86e-a526b5a994e3.jpg?aki_policy=profile_small,https://a0.muscache.com/im/pictures/user/ad16cb03-84f4-48e1-a86e-a526b5a994e3.jpg?aki_policy=profile_x_medium,Cambridge,1,1,"['email', 'phone']",t,f,Neighborhood highlights,Mid-Cambridge,,42.37742,-71.10877,Entire rental unit,Entire home/apt,5,2.5,2.5 baths,3.0,3.0,"[""Essentials"", ""Wifi"", ""Self check-in"", ""Freezer"", ""Lockbox"", ""Private patio or balcony"", ""Carbon monoxide alarm"", ""Cleaning products"", ""Outdoor dining area"", ""BBQ grill"", ""Heating"", ""Stove"", ""Body soap"", ""Bathtub"", ""Dryer"", ""Shower gel"", ""Dining table"", ""Wine glasses"", ""Smoke alarm"", ""Free parking on premises"", ""Indoor fireplace: gas"", ""Toaster"", ""Portable fans"", ""Hot water"", ""Refrigerator"", ""Oven"", ""Hangers"", ""Coffee maker"", ""Dishes and silverware"", ""Blender"", ""Private entrance"", ""Shampoo"", ""Private backyard"", ""Dishwasher"", ""Hot water kettle"", ""Long term stays allowed"", ""Cooking basics"", ""Microwave"", ""Books and reading material"", ""Clothing storage: closet and dresser"", ""AC - split type ductless system"", ""Free washer \u2013 In unit"", ""Iron"", ""Hair dryer"", ""Kitchen""]",$280.00,1,1125,1,1,1125,1125,1.0,1125.0,,t,25,52,55,55,2024-12-28,251,71,4,2017-05-05,2024-12-12,4.98,4.95,4.93,4.98,4.99,4.97,4.89,,f,1,1,0,0,2.69
229,18676360,https://www.airbnb.com/rooms/18676360,20241228025327,2024-12-28,city scrape,Walk to Harvard/MIT (unit 2) w/ parking,"Three bedroom, two bath apartment in Cambridge.  Easy walk to the Central Square metro (3 min), MIT (12 min) and Harvard (12 min).  Parking for 1 large car. This apartment can accommodate up to 7 people.  Our 1st floor unit was such a success that we have transformed the second floor unit for larger parties.","If you like Brooklyn, NY, you will love Central Square.",https://a0.muscache.com/pictures/49c8c42a-ef5d-4f4b-b71c-ec3420cc5530.jpg,35489146,https://www.airbnb.com/users/show/35489146,Ann,2015-06-10,"Cambridge, MA","I am an English teacher for new Americans own the two unit apartment building.    If unable to personally greet you, our two sons will be happy to assist you.  We live two miles away from this building.   We have developed an ""insider's guide to Cambridge"" to provide you with a solid foundation to enjoy your stay.  We frequently stay with Airbnb hosts when we travel.    I am member of two choirs and love history and literature.  ",within a few hours,100.0,98%,t,https://a0.muscache.com/im/pictures/user/19e6d8b2-e50c-493f-a4ac-3ae71c88a530.jpg?aki_policy=profile_small,https://a0.muscache.com/im/pictures/user/19e6d8b2-e50c-493f-a4ac-3ae71c88a530.jpg?aki_policy=profile_x_medium,,2,2,"['email', 'phone']",t,t,Neighborhood highlights,The Port,,42.36612,-71.10307,Entire rental unit,Entire home/apt,6,2.0,2 baths,3.0,6.0,"[""Essentials"", ""Wifi"", ""Self check-in"", ""Free driveway parking on premises \u2013 1 space"", ""Freezer"", ""Lockbox"", ""Carbon monoxide alarm"", ""Heating"", ""Stove"", ""Dryer"", ""Dining table"", ""Wine glasses"", ""Smoke alarm"", ""First aid kit"", ""Pack \u2019n play/Travel crib"", ""Luggage dropoff allowed"", ""Toaster"", ""TV with standard cable"", ""Cleaning available during stay"", ""Hot water"", ""Refrigerator"", ""Oven"", ""Rice maker"", ""Dedicated workspace"", ""Hangers"", ""Coffee maker"", ""Dishes and silverware"", ""Blender"", ""Shampoo"", ""Dishwasher"", ""Hot water kettle"", ""Long term stays allowed"", ""Cooking basics"", ""Microwave"", ""Books and reading material"", ""Fire extinguisher"", ""Washer"", ""Hair dryer"", ""Kitchen""]",$500.00,2,30,2,2,30,30,2.0,30.0,,t,24,54,84,163,2024-12-28,256,31,1,2017-07-02,2024-11-30,4.95,4.97,4.86,4.97,4.95,4.94,4.8,STR-15706,f,2,2,0,0,2.81
231,19423076,https://www.airbnb.com/rooms/19423076,20241228025327,2024-12-28,previous scrape,"Classic Cambridge Victorian near Harvard, Lesley","Classic Cambridge Victorian in beautiful, convenient neighborhood.","Our home is located in beautiful Avon Hill, a historic residential neighborhood near the Porter Square T station, close to all Cambridge has to offer! Harvard Law School, Harvard University, Lesley University, grocery stores, coffee shops, and restaurants are all just a short walk away. We are also convenient to Tufts, and MIT Universities. We live in the apartment upstairs and absolutely love the house and this neighborhood!",https://a0.muscache.com/pictures/miso/Hosting-19423076/original/4a936360-3a87-4b25-8dfe-f51164d8fa08.jpeg,132540621,https://www.airbnb.com/users/show/132540621,David & Jane,2017-05-29,"Cambridge, MA","We are a busy couple who work in healthcare and the arts, but we love to travel and always make time for getaways. We are transplants to Cambridge from England and Hawaii, who love living in this vibrant and welcoming city. There's always something interesting happening here!",,,,f,https://a0.muscache.com/im/pictures/user/017499bc-b559-4b7c-a0c0-c50809e3e32f.jpg?aki_policy=profile_small,https://a0.muscache.com/im/pictures/user/017499bc-b559-4b7c-a0c0-c50809e3e32f.jpg?aki_policy=profile_x_medium,Cambridge,1,2,"['email', 'phone']",t,t,Neighborhood highlights,Neighborhood Nine,,42.38888,-71.12653,Entire condo,Entire home/apt,6,,1.5 baths,2.0,,"[""Essentials"", ""Children\u2019s dinnerware"", ""Central air conditioning"", ""Wifi"", ""Free street parking"", ""Self check-in"", ""Bed linens"", ""Freezer"", ""Conditioner"", ""Private patio or balcony"", ""Carbon monoxide alarm"", ""Cleaning products"", ""Outdoor dining area"", ""High chair"", ""Single level home"", ""Bathtub"", ""Body soap"", ""Shower gel"", ""Dining table"", ""Wine glasses"", ""Smoke alarm"", ""Keypad"", ""Baking sheet"", ""Pack \u2019n play/Travel crib"", ""First aid kit"", ""Free parking on premises"", ""Luggage dropoff allowed"", ""Toaster"", ""Portable fans"", ""Hot water"", ""Refrigerator"", ""Oven"", ""Dedicated workspace"", ""Room-darkening shades"", ""Hangers"", ""Coffee maker"", ""Central heating"", ""Dishes and silverware"", ""Private entrance"", ""Shampoo"", ""Dishwasher"", ""Extra pillows and blankets"", ""Hot water kettle"", ""Gas stove"", ""Cooking basics"", ""Clothing storage"", ""Children\u2019s books and toys"", ""Microwave"", ""Shared backyard"", ""Outdoor furniture"", ""Fire extinguisher"", ""TV"", ""Iron"", ""Hair dryer"", ""Kitchen""]",,2,31,2,2,31,31,2.0,31.0,,t,0,0,0,0,2024-12-28,224,0,0,2017-07-09,2023-06-04,4.96,4.99,4.99,4.99,4.97,4.95,4.86,STR-13547,f,1,1,0,0,2.46
232,19847550,https://www.airbnb.com/rooms/19847550,20241228025327,2024-12-28,city scrape,*New Construction Luxury Kendall Square Townhouse*,"Welcome to the Kendall Square Townhomes!!! This 2,200 SF luxury home is brand new and recently began accepting reservations for occupancy. <br /><br />The four floor unit includes 3 bedrooms and 3.5 bathrooms. The highest end finishes and latest technology can be found throughout the residence.<br /><br />The most central Cambridge location one can ask for is enhanced by top-of-line appliances, direct access garage parking and an outdoor, private deck. Close to the subway, Harvard, MIT and adjacent to Kendall Sq.",,https://a0.muscache.com/pictures/2bda81f4-0eae-40f1-9040-39bbdc0877de.jpg,111823791,https://www.airbnb.com/users/show/111823791,Parker,2017-01-16,"Newton, MA",,,,,f,https://a0.muscache.com/im/pictures/user/c09cdc69-e6a0-4221-b54c-c77d2ef5f49e.jpg?aki_policy=profile_small,https://a0.muscache.com/im/pictures/user/c09cdc69-e6a0-4221-b54c-c77d2ef5f49e.jpg?aki_policy=profile_x_medium,Cambridge,1,2,"['email', 'phone']",t,t,,The Port,,42.36732,-71.09495,Entire townhouse,Entire home/apt,10,3.5,3.5 baths,3.0,5.0,"[""Essentials"", ""Wifi"", ""Ethernet connection"", ""Bed linens"", ""Host greets you"", ""Carbon monoxide alarm"", ""Heating"", ""Stove"", ""Dryer"", ""Breakfast"", ""Smoke alarm"", ""First aid kit"", ""Pack \u2019n play/Travel crib"", ""Free parking on premises"", ""Luggage dropoff allowed"", ""Hot water"", ""Refrigerator"", ""Oven"", ""Hangers"", ""Coffee maker"", ""Dishes and silverware"", ""Private entrance"", ""Shampoo"", ""Patio or balcony"", ""Dishwasher"", ""Extra pillows and blankets"", ""Long term stays allowed"", ""Cooking basics"", ""Microwave"", ""Air conditioning"", ""Fire extinguisher"", ""Washer"", ""TV"", ""Iron"", ""Hair dryer"", ""Kitchen""]",$800.00,91,1125,91,91,1125,1125,91.0,1125.0,,t,28,58,88,178,2024-12-28,0,0,0,,,,,,,,,,,f,1,1,0,0,
238,20419752,https://www.airbnb.com/rooms/20419752,20241228025327,2024-12-28,city scrape,"Modern 3BR, full kitchen, walk to MIT or Harvard","The best location in Cambridge! Spacious and private home with full working kitchen and air conditioning is located near many restaurants (lots of take-out and delivery options), and attractions the city has to offer. Situated in the heart of Cambridge, within minutes of Union Square, MIT, Harvard, Tufts, Central Square, Inman Square, Fenway Park, downtown and more. A great place for family, friends, and business travelers alike, you will love this home away from home.","Features:<br />higher education - music - great food options - bars - street performers ·Harvard University - MIT - parks - museums <br /><br />We love our neighborhood!  You can walk to just about anything, and/or jump on the T, bus or bike - all under 3 minutes from our front door. There are fabulous restaurants, H-mart (across the street), Target, Whole Foods grocery, local coffee shops (or Starbucks), local pubs and shops - all within steps from our home.",https://a0.muscache.com/pictures/hosting/Hosting-20419752/original/b26cc2d3-2227-44df-adb0-91c385d348ec.jpeg,145655051,https://www.airbnb.com/users/show/145655051,Karen,2017-08-12,"Cambridge, MA","A long time resident of Cambridge, I love living in this culturally diverse city right between some of the best educational institutions in the world.  Everything is a short t or walk away.  Originally from Toronto, Canada I love to travel and have enjoyed the Airbnb experience in other countries.  I am excited to now be a host and share our home with others coming to experience Cambridge. ",within an hour,100.0,96%,t,https://a0.muscache.com/im/pictures/user/1d0db54c-3b8c-4e32-bda8-93d3781efa23.jpg?aki_policy=profile_small,https://a0.muscache.com/im/pictures/user/1d0db54c-3b8c-4e32-bda8-93d3781efa23.jpg?aki_policy=profile_x_medium,Cambridge,4,4,"['email', 'phone']",t,t,Neighborhood highlights,The Port,,42.36565,-71.10005,Entire rental unit,Entire home/apt,5,1.0,1 bath,3.0,3.0,"[""Paid parking on premises"", ""Essentials"", ""Children\u2019s dinnerware"", ""Central air conditioning"", ""Wifi"", ""Self check-in"", ""Baby bath"", ""Bed linens"", ""Freezer"", ""Carbon monoxide alarm"", ""High chair"", ""Heating"", ""Coffee"", ""Body soap"", ""Bathtub"", ""Sound system"", ""Dining table"", ""Wine glasses"", ""Smoke alarm"", ""Keypad"", ""Baking sheet"", ""Pack \u2019n play/Travel crib"", ""First aid kit"", ""Toaster"", ""Changing table"", ""Hot water"", ""Refrigerator"", ""Oven"", ""Dedicated workspace"", ""Room-darkening shades"", ""Hangers"", ""Coffee maker"", ""Paid parking off premises"", ""Dishes and silverware"", ""Private entrance"", ""Shampoo"", ""Dishwasher"", ""Extra pillows and blankets"", ""Hot water kettle"", ""Gas stove"", ""Free dryer \u2013 In unit"", ""Cooking basics"", ""Children\u2019s books and toys"", ""Microwave"", ""Books and reading material"", ""Trash compactor"", ""Fire extinguisher"", ""Free washer \u2013 In unit"", ""TV"", ""Iron"", ""Hair dryer"", ""Kitchen""]",$379.00,2,29,2,4,29,29,2.7,29.0,,t,30,57,80,237,2024-12-28,300,48,0,2017-09-27,2024-11-24,4.79,4.86,4.86,4.96,4.92,4.86,4.65,ROC-15228847-004,f,4,4,0,0,3.4
