,id,listing_url,scrape_id,last_scraped,source,name,description,neighborhood_overview,picture_url,host_id,host_url,host_name,host_since,host_location,host_about,host_response_time,host_response_rate,host_acceptance_rate,host_is_superhost,host_thumbnail_url,host_picture_url,host_neighbourhood,host_listings_count,host_total_listings_count,host_verifications,host_has_profile_pic,host_identity_verified,neighbourhood,neighbourhood_cleansed,neighbourhood_group_cleansed,latitude,longitude,property_type,room_type,accommodates,bathrooms,bathrooms_text,bedrooms,beds,amenities,price,minimum_nights,maximum_nights,minimum_minimum_nights,maximum_minimum_nights,minimum_maximum_nights,maximum_maximum_nights,minimum_nights_avg_ntm,maximum_nights_avg_ntm,calendar_updated,has_availability,availability_30,availability_60,availability_90,availability_365,calendar_last_scraped,number_of_reviews,number_of_reviews_ltm,number_of_reviews_l30d,first_review,last_review,review_scores_rating,review_scores_accuracy,review_scores_cleanliness,review_scores_checkin,review_scores_communication,review_scores_location,review_scores_value,license,instant_bookable,calculated_host_listings_count,calculated_host_listings_count_entire_homes,calculated_host_listings_count_private_rooms,calculated_host_listings_count_shared_rooms,reviews_per_month
0,8521,https://www.airbnb.com/rooms/8521,20241228025327,2024-12-28,previous scrape,SunsplashedSerenity walk to Harvard & Fresh Pond,"An elegant, sun-splashed, 2 bedroom (+2offices) apartment with parking, a 15-minute walk or 7-minute bike ride to Harvard (bikes provided).  Enjoy this spacious 1st floor unit in a stylish 3-level house, with its gorgeous yard and two bluestone patios, on a quiet leafy street in Huron Village Cambridge.  Sleeps 5.","Huron Village is known for its charm.  We have playgrounds, a reservoir, small artisans, a used bookstore, antiques, and two bakery-cafes all within walking distance of Harvard Square.  You'll also find scrumptious take-out in several local places. (URL HIDDEN)<br />(URL HIDDEN)",https://a0.muscache.com/pictures/30536/072e0a55_original.jpg,306681,https://www.airbnb.com/users/show/306681,Janet,2010-12-01,"Cambridge, MA","I'm a professor at one of the local universities and a long-time Cambridge resident.  I live on the second floor at 64 Granville Road with my daughter.  We enjoy sharing our ""Cambridge tips"" with all of our visitors: where to ice-skate in winter or rent a canoe in summer, the best local places for cheese, bread, and yummy ethnic take-out treats.  We can lend you bikes and direct you to the Minuteman Bikeway, an 11-mile shady ride through Arlington, Lexington and Bedford, or give you a couple of sleds and show you the hill at Fresh Pond.  Whatever the season, we look forward to welcoming you when you're in Cambridge.",within an hour,100.0,67%,t,https://a0.muscache.com/im/users/306681/profile_pic/1309790297/original.jpg?aki_policy=profile_small,https://a0.muscache.com/im/users/306681/profile_pic/1309790297/original.jpg?aki_policy=profile_x_medium,Cambridge,2,3,"['email', 'phone']",t,t,Neighborhood highlights,West Cambridge,,42.38258,-71.13646,Entire rental unit,Entire home/apt,5,,1 bath,2.0,,"[""Paid parking on premises"", ""Essentials"", ""Children\u2019s dinnerware"", ""Wifi"", ""Free street parking"", ""Bed linens"", ""Host greets you"", ""Carbon monoxide alarm"", ""High chair"", ""Babysitter recommendations"", ""BBQ grill"", ""Single level home"", ""Heating"", ""Stove"", ""Bathtub"", ""Dryer"", ""Shower gel"", ""Smoke alarm"", ""Baking sheet"", ""Pack \u2019n play/Travel crib"", ""Luggage dropoff allowed"", ""TV with standard cable"", ""Hot water"", ""Refrigerator"", ""Oven"", ""Dedicated workspace"", ""Hangers"", ""Coffee maker"", ""Dishes and silverware"", ""Barbecue utensils"", ""Outlet covers"", ""Shampoo"", ""Dishwasher"", ""Extra pillows and blankets"", ""Private entrance"", ""Shared patio or balcony"", ""Long term stays allowed"", ""Beach essentials"", ""Cooking basics"", ""Shared backyard \u2013 Not fully fenced"", ""Children\u2019s books and toys"", ""Microwave"", ""Air conditioning"", ""Washer"", ""Iron"", ""Kitchen""]",,2,1125,2,3,1125,1125,2.0,1125.0,,t,16,16,16,225,2024-12-28,76,10,0,2009-07-23,2024-09-01,4.83,4.95,4.97,4.89,4.92,4.93,4.74,C0121120491,f,2,2,0,0,0.4
9,445407,https://www.airbnb.com/rooms/445407,20241228025327,2024-12-28,city scrape,East Cambridge Apartment,Our four bedroom home is tucked away in a wonderful neighborhood in East Cambridge.  Walk to great neighborhood restaurants and enjoy day trips to Boston with easy access to bus and train lines.  Enjoy the backyard and charm of Cambridge.,Neighborhood is tucked away behind MIT and Kendall Square.  East Cambridge still has a strong Portuguese population that is apparent with grape vines surrounding our yard.  Our oldest son goes to school down the street and we love the community and our neighborhood.  ,https://a0.muscache.com/pictures/airflow/Hosting-445407/original/f7820476-f669-497f-8e09-cb0874b44782.jpg,2212429,https://www.airbnb.com/users/show/2212429,Jimmy,2012-04-24,"Cambridge, MA","My wife and I are teachers north of Boston and have 4 children.  We enjoy traveling, being active, and spending time in Cape Cod and Lake Ontario.
  
As a family we enjoy seeing different places and experiencing different cultures.  We love the concept of Airbnb and as a young family, we love the idea of living somewhere else and having the flexibility/comforts of a kitchen and yard.",within an hour,100.0,100%,t,https://a0.muscache.com/im/users/2212429/profile_pic/1423275652/original.jpg?aki_policy=profile_small,https://a0.muscache.com/im/users/2212429/profile_pic/1423275652/original.jpg?aki_policy=profile_x_medium,Cambridge,3,3,"['email', 'phone', 'work_email']",t,t,Neighborhood highlights,Wellington-Harrington,,42.37147,-71.08939,Entire rental unit,Entire home/apt,7,2.0,2 baths,4.0,6.0,"[""Essentials"", ""Wifi"", ""Self check-in"", ""Bed linens"", ""Carbon monoxide alarm"", ""Outdoor dining area"", ""BBQ grill"", ""Heating"", ""Body soap"", ""Dryer"", ""Smoke alarm"", ""First aid kit"", ""Free parking on premises"", ""Smart lock"", ""TV with standard cable"", ""Hot water"", ""Refrigerator"", ""Room-darkening shades"", ""Hangers"", ""Coffee maker"", ""Dishes and silverware"", ""Shampoo"", ""Cooking basics"", ""Clothing storage"", ""Children\u2019s books and toys"", ""Microwave"", ""Air conditioning"", ""Outdoor furniture"", ""Fire extinguisher"", ""Washer"", ""Backyard"", ""Iron"", ""Hair dryer"", ""Kitchen""]","$1,500.00",2,28,2,2,1125,1125,2.0,1125.0,,t,0,0,0,4,2024-12-28,80,5,0,2012-06-29,2024-08-19,4.94,4.89,4.91,4.96,4.99,4.8,4.76,STR-17249,t,2,2,0,0,0.53
17,1080789,https://www.airbnb.com/rooms/1080789,20241228025327,2024-12-28,previous scrape,Entire Fabulous home: Available occasionally!,"4 bedrooms, 2 full baths! Safe, comfortable, bright, happy architecturally designed. fun Cambridge neighborhood. Walk to trains, bus, Harvard/Davis/Porter. Comfortably fits 7 people for family sabbatical or holiday. 4 bedrooms, (2 queens, one full, one single—all very high end comfortable mattresses/organic). Leafy, quiet neighborhood near cool city spots; walk, bike or bus to Harvard!  **Pls note: Must like children; pitter-patter of v sweet  2 & 5 yr-olds running above us for short spurts!","great neighborhood, again deets will be found in other listing",https://a0.muscache.com/pictures/miso/Hosting-1080789/original/55473caf-52ba-40ae-adde-11e03e60bcbe.jpeg,40965,https://www.airbnb.com/users/show/40965,Judith L,2009-09-24,"Cambridge, MA","Friendly, politically progressive, resourceful... I love hosting people from all over the world, and know the area well for a native NY'er. You will find the environment 'on the court' restful, peaceful and as one  guest from put it, ""I  figured you were a healer of some sort-- because your home feels healing."" Our place is relaxing and down to earth, with  an artistic and colorful ambiance, and lots of sunlight.",within a few hours,100.0,50%,t,https://a0.muscache.com/im/users/40965/profile_pic/1417297269/original.jpg?aki_policy=profile_small,https://a0.muscache.com/im/users/40965/profile_pic/1417297269/original.jpg?aki_policy=profile_x_medium,Cambridge,4,4,"['email', 'phone']",t,t,Neighborhood highlights,North Cambridge,,42.39426,-71.13258,Entire condo,Entire home/apt,7,,2 baths,4.0,,"[""Heating"", ""TV with standard cable"", ""Wifi"", ""Pets allowed"", ""Self check-in"", ""Dryer"", ""Air conditioning"", ""Smoke alarm"", ""Washer"", ""Coffee maker"", ""Lockbox"", ""Carbon monoxide alarm"", ""Patio or balcony"", ""Kitchen""]",,10,30,10,10,30,30,10.0,30.0,,t,23,53,83,349,2024-12-28,0,0,0,,,,,,,,,,C0169140491,f,3,1,2,0,
30,1855969,https://www.airbnb.com/rooms/1855969,20241228025327,2024-12-28,previous scrape,Lux 2 Bedroom Cambridge Apt by MIT,"Our apartment is located in Watermark Kendall West, one of the most exciting places to live, work, shop & play in the Boston area. At this community, there is an array of amenities such as a mezzanine terrace with a garden, fitness center and more.","Live in the most exciting and vibrant neighborhood of Massachusetts. Kendall Square is a brimming area with cutting edge technology, science, design, innovation, creative restaurants, and fist-class shopping and is only a couple of metro stations away from downtown Boston. Take a few steps down the street and wander around the renowned Massachusetts Institute of Technology campus. Continue the knowledge tour at the Harvard University campus, where you’ll find peace and relax in its beautiful gardens and historic buildings. Unwind at the Charles River banks and enjoy the fantastic Boston views, where many trails and bike paths offer a haven to enjoy nature and a healthy lifestyle. Just across the Charles River you will be in downtown Boston surrounded by its gorgeous Revolution-era architecture and historic landmarks. The apartment is located in a modern high-rise boasting spectacular views and world-class resident amenities including a fitness center, a Zen garden, a clubhouse, and ful",https://a0.muscache.com/pictures/prohost-api/Hosting-1855969/original/2a646abb-d6cf-4d6d-aac0-2b70cfe1e8c8.jpeg,9419684,https://www.airbnb.com/users/show/9419684,Churchill,2013-10-14,"New York, NY","We have been providing vacation rental apartments for over 10 years across the East Coast. We are known for our distinctively furnished apartments in popular locations, and for our attentive service. You’ll find that our rates are quite reasonable. If you're looking for a safe, comfortable place with fabulous amenities and Wi-Fi (we know you need the Wi-Fi!) in the Boston MA area, Washington DC, Miami FL or very close to NYC in Jersey City or Hoboken, we'd love to host you. Many of the buildings where our apartments are located feature amenities such as beautiful lobbies, 24 hour front desk staff, fitness centers, business centers, recreation rooms, indoor or outdoor pools and whirlpools. If you are traveling with children, some buildings offer playgrounds (many buildings are near public playgrounds as well) or indoor playrooms. Depending on the location, you can stay for just a few days, a week, a month or more. 

We offer an assortment of short-term apartments in sizes ranging from a studio to three bedrooms that are fully furnished with all the comforts of home. Our local staff meticulously prepares your apartment before your arrival, and we offer 24 hour assistance for any emergencies after business hours. When you arrive at your apartment, the beds will be made, towels and bath amenities will be stocked in the bathrooms, and the coffee maker will be set up in the kitchen with some sample coffees, sweetener and creamer (teabags too if that is your preference) to start your morning off properly. If you’d like to cook a meal, the kitchen is stocked with dishes, cutlery, glassware and pots and pans. The living room is set up with a TV and cable channels, and the Wi-Fi router password and instructions will be prominently displayed so you can get connected quickly. You can also make local and toll-free phone calls at no charge. 

Please contact us to confirm the exact availability of the apartment you are interested in. We’d love to host you (and your family) for your vacation or business trip. ",within a few hours,71.0,100%,f,https://a0.muscache.com/im/users/9419684/profile_pic/1427816343/original.jpg?aki_policy=profile_small,https://a0.muscache.com/im/users/9419684/profile_pic/1427816343/original.jpg?aki_policy=profile_x_medium,Cambridge,196,1204,"['email', 'phone']",t,t,Neighborhood highlights,East Cambridge,,42.363747,-71.083374,Entire serviced apartment,Entire home/apt,5,,2 baths,2.0,,"[""Paid parking on premises"", ""Essentials"", ""Wifi"", ""Ethernet connection"", ""Building staff"", ""Self check-in"", ""Elevator"", ""Bed linens"", ""Freezer"", ""Conditioner"", ""Window guards"", ""Carbon monoxide alarm"", ""Cleaning products"", ""Heating"", ""Stove"", ""Coffee"", ""Body soap"", ""Pets allowed"", ""Dryer"", ""Shower gel"", ""Dining table"", ""Wine glasses"", ""Smoke alarm"", ""Baking sheet"", ""Toaster"", ""Hot water"", ""Refrigerator"", ""Oven"", ""Crib - available upon request"", ""Dedicated workspace"", ""Hangers"", ""Coffee maker"", ""Paid parking off premises"", ""Dishes and silverware"", ""Blender"", ""Shampoo"", ""Dishwasher"", ""Extra pillows and blankets"", ""Hot water kettle"", ""Long term stays allowed"", ""Cooking basics"", ""Clothing storage"", ""Microwave"", ""Air conditioning"", ""Washer"", ""TV"", ""Iron"", ""Exercise equipment"", ""Hair dryer"", ""Kitchen""]",,31,1125,31,31,1125,1125,31.0,1125.0,,t,29,59,89,364,2024-12-28,32,0,0,2014-01-12,2022-05-20,4.91,4.69,4.94,4.78,4.84,4.84,4.78,C0281180491,t,11,11,0,0,0.24
33,1984737,https://www.airbnb.com/rooms/1984737,20241228025327,2024-12-28,previous scrape,Charming Harvard Victorian,Charming Victorian a 10 minute walk or 5 min trolley ride to Harvard square. Close to MIT and Harvard.<br /><br />Nestled up to Harvard sq. our home has stunning old charm with great period character and one off street parking space.,"Nestled up to Harvard and surrounds the neighborhood is quiet, well established, and beautiful with a lot of history and many famous residents past and current.  <br /><br />Located in the neighborhood of Cambridge called Huron Village, the home is blocks away from the historic Longfellow house, Harvard, Radcliff, Leslie and the entire area exudes Victorian charm.  <br /><br />There is easy and quick access to local stores, tree lines streets, and it offers exceptionally easy access to all things Cambridge and Boston, no car required!",https://a0.muscache.com/pictures/76761d3a-7261-4ee8-b38c-7fcf1c6bacfd.jpg,8824696,https://www.airbnb.com/users/show/8824696,Steve,2013-09-14,"Cambridge, MA","I love anything with a story behind it.

In Phoenix, we offer a perfect sanctuary near the city's attractions.

In Cambridge/Boston, we care for a 124-year-old Victorian with New England charm, preserving its classic features and greening where possible. 

We share these homes, using earnings to renovate further. We hope you love them as much as we do!

We also help owners share their special homes with others.",within an hour,100.0,98%,t,https://a0.muscache.com/im/pictures/user/User/original/510c7bd2-c20d-46cf-8c16-1b83c85058ba.jpeg?aki_policy=profile_small,https://a0.muscache.com/im/pictures/user/User/original/510c7bd2-c20d-46cf-8c16-1b83c85058ba.jpeg?aki_policy=profile_x_medium,Cambridge,4,5,"['email', 'phone', 'work_email']",t,t,Neighborhood highlights,West Cambridge,,42.38248,-71.13545,Entire home,Entire home/apt,10,,1.5 baths,4.0,,"[""Essentials"", ""Children\u2019s dinnerware"", ""Organic conditioner"", ""Ethernet connection"", ""Free street parking"", ""Self check-in"", ""Bed linens"", ""Freezer"", ""Bikes"", ""Ceiling fan"", ""Private patio or balcony"", ""Paid parking lot on premises \u2013 1 space"", ""Carbon monoxide alarm"", ""BBQ grill: gas"", ""Cleaning products"", ""Outdoor dining area"", ""High chair"", ""Free washer \u2013 In building"", ""Heating"", ""Stove"", ""Coffee"", ""Bathtub"", ""Paid parking off premises"", ""Shower gel"", ""Dining table"", ""Wine glasses"", ""Smoke alarm"", ""Baking sheet"", ""Pack \u2019n play/Travel crib"", ""First aid kit"", ""Backyard - Fully fenced"", ""Free parking on premises"", ""Luggage dropoff allowed"", ""Amazon  sound system"", ""Toaster"", ""Smart lock"", ""Noise decibel monitors on property"", ""Fast wifi \u2013 458 Mbps"", ""Portable fans"", ""Hot water"", ""Refrigerator"", ""Oven"", ""Rice maker"", ""Dedicated workspace"", ""Room-darkening shades"", ""Hangers"", ""Free dryer \u2013 In building"", ""Crib"", ""Dishes and silverware"", ""Coffee maker"", ""Blender"", ""65 inch HDTV with standard cable"", ""Shampoo"", ""Dishwasher"", ""Extra pillows and blankets"", ""Hot water kettle"", ""Private entrance"", ""Long term stays allowed"", ""Cooking basics"", ""Children\u2019s books and toys"", ""Microwave"", ""Organic body soap"", ""Books and reading material"", ""Clothing storage: closet and dresser"", ""Air conditioning"", ""Fire extinguisher"", ""Outdoor furniture"", ""Exterior security cameras on property"", ""Iron"", ""Hair dryer"", ""Kitchen""]",,2,1125,3,5,1125,1125,4.4,1125.0,,t,0,0,0,210,2024-12-28,403,15,0,2014-06-01,2024-10-27,4.74,4.62,4.71,4.85,4.91,4.86,4.65,STR-13324,f,2,2,0,0,3.13
47,3167866,https://www.airbnb.com/rooms/3167866,20241228025327,2024-12-28,city scrape,"""Green"" House + parking Harvard/MIT","Come and stay at our beautiful house in Cambridge. We have a state-of-the-art kitchen and remodeled bathrooms.  There is free parking in our driveway, and we are very close to the T (Kendall Square or Lechmere Station). We also have a cute backyard.","We consider our neighborhood a suburban sanctuary within the city!  The area is extremely quiet and safe, consisting mainly of families with children or working professionals.  Within a 5-10 minute walk, you have access to a supermarket, a shopping plaza, plenty of cafes, restaurants, and pubs, a movie theatre, a park, and car/bike rentals.",https://a0.muscache.com/pictures/49877026/50d86335_original.jpg,4297079,https://www.airbnb.com/users/show/4297079,Charlton & Theresa,2012-12-01,"Tustin, CA","We are working professionals in our late 30's.  We are high school sweethearts and attended UCLA together.  We moved to the Boston area in 2012.  

Charlton works in the Information Technology field and got his MBA from Boston University.  Theresa is an elementary school teacher at a charter school.  We love traveling, hiking, eating healthy, exploring new places, watching movies, reading, and meeting new people.  We have been hosting off and on for the past decade, and would love for you to stay at our beautiful house!
",within a few hours,100.0,100%,f,https://a0.muscache.com/im/users/4297079/profile_pic/1354736363/original.jpg?aki_policy=profile_small,https://a0.muscache.com/im/users/4297079/profile_pic/1354736363/original.jpg?aki_policy=profile_x_medium,Cambridge,1,4,"['email', 'phone']",t,t,Neighborhood highlights,Wellington-Harrington,,42.37006378173828,-71.08882141113281,Entire townhouse,Entire home/apt,5,2.0,2 baths,3.0,3.0,"[""Essentials"", ""42 inch HDTV with Roku"", ""Maytag refrigerator"", ""Portable heater"", ""Self check-in"", ""Bed linens"", ""Freezer"", ""Conditioner"", ""Carbon monoxide alarm"", ""Cleaning products"", ""Laundromat nearby"", ""Outdoor dining area"", ""High chair"", ""Mini fridge"", ""Coffee maker: drip coffee maker"", ""Bathtub"", ""Body soap"", ""Drying rack for clothing"", ""Shower gel"", ""Portable air conditioning"", ""Fast wifi \u2013 214 Mbps"", ""Stainless steel oven"", ""Dining table"", ""Smoke alarm"", ""Keypad"", ""First aid kit"", ""Free parking on premises"", ""Luggage dropoff allowed"", ""Toaster"", ""Radiant heating"", ""Hot water"", ""Rice maker"", ""Dedicated workspace"", ""Room-darkening shades"", ""Hangers"", ""Dishes and silverware"", ""Blender"", ""Barbecue utensils"", ""Shampoo"", ""Whirlpool stainless steel gas stove"", ""Dishwasher"", ""Extra pillows and blankets"", ""Hot water kettle"", ""Private entrance"", ""City skyline view"", ""Patio or balcony"", ""Long term stays allowed"", ""Free dryer \u2013 In unit"", ""Cooking basics"", ""Children\u2019s books and toys"", ""Microwave"", ""Private backyard \u2013 Fully fenced"", ""Clothing storage: closet and dresser"", ""Fire extinguisher"", ""AC - split type ductless system"", ""Free washer \u2013 In unit"", ""Heating - split type ductless system"", ""Board games"", ""Exterior security cameras on property"", ""Outdoor furniture"", ""Private BBQ grill: gas"", ""EV charger"", ""Iron"", ""Hair dryer"", ""Kitchen""]",$295.00,28,250,28,28,250,250,28.0,250.0,,t,30,60,90,180,2024-12-28,81,0,0,2014-06-15,2022-06-14,4.83,4.86,4.73,4.91,4.93,4.79,4.75,STR-63106,f,1,1,0,0,0.63
49,3247833,https://www.airbnb.com/rooms/3247833,20241228025327,2024-12-28,city scrape,Lovely East Cambridge Apartment,"This second floor apartment is situated a short distance from MIT, steps away from Kendall Square and very close to public transportation to get to Harvard Square, the Charles River and Boston.  Walking distance to great restaurants.<br />You will be given a 4 digit code that will allow you to come and go as you please.  We understand how hard it is to travel with kids so we are equipped for young families with pack & plays, a stroller and portable high chair.","The apartment is located in a wonderful neighborhood between Kendall and Inman Square.   There are quality bars, restaurants and an ample amount of parks within walking distance.",https://a0.muscache.com/pictures/12e1e3a0-bec0-47ca-be81-f95ec9a74d63.jpg,2212429,https://www.airbnb.com/users/show/2212429,Jimmy,2012-04-24,"Cambridge, MA","My wife and I are teachers north of Boston and have 4 children.  We enjoy traveling, being active, and spending time in Cape Cod and Lake Ontario.
  
As a family we enjoy seeing different places and experiencing different cultures.  We love the concept of Airbnb and as a young family, we love the idea of living somewhere else and having the flexibility/comforts of a kitchen and yard.",within an hour,100.0,100%,t,https://a0.muscache.com/im/users/2212429/profile_pic/1423275652/original.jpg?aki_policy=profile_small,https://a0.muscache.com/im/users/2212429/profile_pic/1423275652/original.jpg?aki_policy=profile_x_medium,Cambridge,3,3,"['email', 'phone', 'work_email']",t,t,Neighborhood highlights,Wellington-Harrington,,42.37032,-71.09317,Entire rental unit,Entire home/apt,5,1.0,1 bath,3.0,4.0,"[""Essentials"", ""Children\u2019s dinnerware"", ""Wifi"", ""Free street parking"", ""Self check-in"", ""Carbon monoxide alarm"", ""High chair"", ""Babysitter recommendations"", ""Heating"", ""Bathtub"", ""Dryer"", ""Smoke alarm"", ""Keypad"", ""Pack \u2019n play/Travel crib"", ""First aid kit"", ""Luggage dropoff allowed"", ""TV with standard cable"", ""Hot water"", ""Refrigerator"", ""Hangers"", ""Crib"", ""Coffee maker"", ""Dishes and silverware"", ""Outlet covers"", ""Shampoo"", ""Cooking basics"", ""Children\u2019s books and toys"", ""Air conditioning"", ""Fire extinguisher"", ""Washer"", ""Iron"", ""Hair dryer"", ""Kitchen""]",$186.00,2,90,2,2,1125,1125,2.0,1125.0,,t,11,32,45,285,2024-12-28,634,61,1,2015-03-11,2024-12-18,4.86,4.88,4.86,4.99,4.98,4.87,4.81,STR-13597,t,2,2,0,0,5.31
