576,555228691792675796,https://www.airbnb.com/rooms/555228691792675796,20241228025327,2024-12-28,city scrape,"Charming Multi-Level Townhouse, Harvard, MIT, MBTA","Location, location, location, charming multi-level townhouse found minutes to Harvard Business School, Red line, and Central Square. Easy access to MIT, Longwood Medical hospitals,  universities, Harvard , Kendall and Inman Sq.","Riverside is a residential neighborhood located along the Charles River, which includes some of the oldest settled parts of Cambridge. Harvard Square and Central Square, both major commercial and transit centers, lie at either end of the neighborhood. Massachusetts Avenue, which connects the two squares, serves as the neighborhood’s retail. Smaller commercial areas exist along Putnam Avenue, Western Avenue and River Street. Much of Harvard University’s student housing is located in Riverside. Riverside is also home to some of Harvard’s academic facilities and the primary academic and administrative facility for Cambridge College<br />Riverside is a neighborhood in Cambridge, Massachusetts with a population of 12,181. Riverside is in Middlesex County and is one of the best places to live in Massachusetts. Living in Riverside offers residents a dense urban feel and most residents rent their homes. In Riverside there are a lot of bars, restaurants, coffee shops, and parks. Many young prof",https://a0.muscache.com/pictures/miso/Hosting-555228691792675796/original/1fc8c505-7947-4652-9bc6-218a6dcdb58d.jpeg,266312920,https://www.airbnb.com/users/show/266312920,STARS Of,2019-06-04,"Boston, MA","Welcome to STARS of Boston (Short Term Apartment Rental Solutions) -- our name says it all! We offer stylishly furnished and accessorized apartments as superior value alternatives to hotels. Our private rooms, studio, one, two, three & four bedroom apartments and homes have been carefully curated to provide a refuge for work, play or rejuvenation. 
STARS offers flexible term stays in the most desirable areas around Greater Boston, Brookline, Longwood Medical Area, most major universities and Cambridge. Our units are pet friendly and accessible by public transit or order up VIP service for airport transfers, a personal driver or pet and child care. Special request? We’ll gladly check into it. We’d love to host you, just call or email us for best rates and availability. ",within an hour,100.0,89%,f,https://a0.muscache.com/im/pictures/user/70077bc0-c203-4eed-b154-cf523c514acc.jpg?aki_policy=profile_small,https://a0.muscache.com/im/pictures/user/70077bc0-c203-4eed-b154-cf523c514acc.jpg?aki_policy=profile_x_medium,Brookline,79,135,"['email', 'phone', 'work_email']",t,t,Neighborhood highlights,Riverside,,42.36614,-71.11094,Entire rental unit,Entire home/apt,5,1.5,1.5 baths,2.0,1.0,"[""Paid parking on premises"", ""Essentials"", ""Wifi"", ""Self check-in"", ""Freezer"", ""Conditioner"", ""Lockbox"", ""Carbon monoxide alarm"", ""Cleaning products"", ""High chair"", ""Coffee"", ""Stove"", ""Bathtub"", ""Body soap"", ""Pets allowed"", ""Shower gel"", ""Dining table"", ""Paid dryer \u2013 In building"", ""Wine glasses"", ""Smoke alarm"", ""Baking sheet"", ""Coffee maker: Keurig coffee machine"", ""Luggage dropoff allowed"", ""Toaster"", ""Radiant heating"", ""Portable fans"", ""Hot water"", ""Refrigerator"", ""Oven"", ""Dedicated workspace"", ""Hangers"", ""Crib"", ""Dishes and silverware"", ""Blender"", ""Private entrance"", ""Shampoo"", ""Extra pillows and blankets"", ""Hot water kettle"", ""Long term stays allowed"", ""Pack \u2019n play/Travel crib - available upon request"", ""Clothing storage"", ""Cooking basics"", ""Microwave"", ""Paid washer \u2013 In building"", ""Air conditioning"", ""Fire extinguisher"", ""TV"", ""Iron"", ""Hair dryer"", ""Kitchen""]",$150.00,4,365,3,28,365,365,26.5,365.0,,t,28,58,88,363,2024-12-28,6,1,0,2022-04-01,2024-05-12,3.5,4.0,4.5,4.33,3.5,4.83,3.33,,f,9,9,0,0,0.18
583,560782999379858921,https://www.airbnb.com/rooms/560782999379858921,20241228025327,2024-12-28,city scrape,3 Bed w/ Free Parking in East Cambridge,"This is a very well located 3 bed apartment with nearby parking (a very rare amenity in the Cambridge/Boston area). You'll be close to MIT, Harvard, the Charles River, as well as several shopping areas and grocery stores that have everything you'd need during your stay.<br /><br />This is a great place to stay for your trip to Cambridge or Boston area.","Very nice, quiet, and safe neighborhood. Near many shops and stores for all your day to day needs. Within walking distance to parks, the river, MIT, and other major sites.",https://a0.muscache.com/pictures/miso/Hosting-560782999379858921/original/29f7b6e3-ae12-4df6-a3ce-9fb054a7a9ad.jpeg,43450256,https://www.airbnb.com/users/show/43450256,Steve,2015-09-05,"Cambridge, MA",,within an hour,88.0,59%,f,https://a0.muscache.com/im/users/43450256/profile_pic/1441495503/original.jpg?aki_policy=profile_small,https://a0.muscache.com/im/users/43450256/profile_pic/1441495503/original.jpg?aki_policy=profile_x_medium,Cambridge,124,180,"['email', 'phone']",t,t,Neighborhood highlights,Wellington-Harrington,,42.37258,-71.0894,Entire rental unit,Entire home/apt,5,1.0,1 bath,3.0,3.0,"[""Essentials"", ""Wifi"", ""Bed linens"", ""Freezer"", ""Carbon monoxide alarm"", ""Cleaning products"", ""Heating"", ""Coffee"", ""Dryer"", ""Shower gel"", ""Dining table"", ""Wine glasses"", ""Smoke alarm"", ""Free parking on premises"", ""Hot water"", ""Refrigerator"", ""Dedicated workspace"", ""Hangers"", ""Coffee maker"", ""Dishes and silverware"", ""Shampoo"", ""Extra pillows and blankets"", ""Hot water kettle"", ""Long term stays allowed"", ""Clothing storage"", ""Microwave"", ""Air conditioning"", ""Washer"", ""Iron"", ""Hair dryer"", ""Kitchen""]",$150.00,30,365,30,30,365,365,30.0,365.0,,t,0,0,0,265,2024-12-28,2,0,0,2022-08-16,2023-06-26,5.0,5.0,5.0,5.0,5.0,5.0,5.0,,f,61,30,31,0,0.07
600,583925819909710745,https://www.airbnb.com/rooms/583925819909710745,20241228025327,2024-12-28,city scrape,Charming Apartment in the Heart of Cambridge!,"Whether you're a traveling professional or an urban adventurer, this Cambridge vacation rental will make you feel right at home. Nestled between Harvard and Central Squares, this 2-bedroom, 1-bathroom apartment gives you easy access to public transportation, several restaurants, the Dr. Paul Dudley White Bike Path, and Riverbend Park. Highlighted by tasteful decor, 3 Smart TVs, a well-equipped kitchen, and an in-unit washer/dryer set, this home has everything you need for a stress-free stay.","CAMBRIDGE HANGOUTS: Harvard Art Museums (0.7 miles), Sanders Theater (0.8 miles), Harvard University (0.9 miles), The Harvard Museum of Natural History (1.1 miles), Massachusetts Institute of Technology (1.1 miles), Museum of Science (3.6 miles) <br />OUTDOOR ADVENTURE: Dr. Paul Dudley White Bike Path (0.1 miles), Riverbend Park (0.4 miles), Hoyt Field (0.4 miles), Wheeler Park (0.5 miles) <br />DINE + DRINK: The Nu Do’ Society (0.5 miles), Dumping House (0.5 miles), Daedalus (0.6 miles), Beantown Taqueria Cafe (0.6 miles), Brick & Mortar (0.9 miles)  <br />TRANSPORTATION: Central Square (0.8 miles), Harvard Square (0.8 miles) <br />AIRPORT: Boston Logan International Airport (7.5 miles)",https://a0.muscache.com/pictures/prohost-api/Hosting-583925819909710745/original/d3b4e365-5bf1-4de5-9dac-fe33ec2eb9b2.jpeg,122377513,https://www.airbnb.com/users/show/122377513,Evolve,2017-03-24,United States,"Hi! We’re Evolve, the hospitality team that helps you rest easy when you rent a private, professionally cleaned home from us.

We promise your rental will be clean, safe, and true to what you saw on Airbnb or we'll make it right. Check-ins are always smooth, and we're here 24/7 to answer any questions or help you find the perfect property.",within an hour,100.0,99%,f,https://a0.muscache.com/im/pictures/user/User-122377513/original/0803858b-7a5d-49ba-8e73-20290d0a5585.png?aki_policy=profile_small,https://a0.muscache.com/im/pictures/user/User-122377513/original/0803858b-7a5d-49ba-8e73-20290d0a5585.png?aki_policy=profile_x_medium,East Otis,521,1135,"['email', 'phone']",t,t,Neighborhood highlights,Riverside,,42.366,-71.11369,Entire rental unit,Entire home/apt,5,1.0,1 bath,2.0,3.0,"[""Essentials"", ""Wifi"", ""Self check-in"", ""Bed linens"", ""Bikes"", ""Carbon monoxide alarm"", ""BBQ grill"", ""Heating"", ""Dryer"", ""Smoke alarm"", ""Keypad"", ""First aid kit"", ""Hot water"", ""Hangers"", ""Private entrance"", ""Shampoo"", ""Long term stays allowed"", ""Cooking basics"", ""Clothing storage"", ""Air conditioning"", ""Kayak"", ""Fire extinguisher"", ""Washer"", ""TV"", ""Iron"", ""Hair dryer"", ""Kitchen""]",$159.00,30,1125,30,30,1125,1125,30.0,1125.0,,t,12,42,72,347,2024-12-28,1,0,0,2022-11-05,2022-11-05,1.0,1.0,1.0,4.0,4.0,3.0,1.0,C0984769728,t,1,1,0,0,0.04
606,587810796761966455,https://www.airbnb.com/rooms/587810796761966455,20241228025327,2024-12-28,city scrape,Beautiful & Sunny Home in the heart of Cambridge,"You will enjoy easy access to everything in Cambridge and Boston from this sunny and spacious central location. Wonderful restaurants, shops and parks  nearby in both Central and Harvard Square. Off street parking for 2 cars and large dining room. very close to Central Square MBTA station. Short walk to Harvard & Central Square and Charles River. Perfect for Harvard graduation week and Boston area cultural events. Fenced back yard has large outdoor grill and stone patio for outdoor dining!","Our home is in the heart of Central Square very close to the Central Square, MBTA station as well as both Harvard Square and Central Square . It is right between Harvard and MIT",https://a0.muscache.com/pictures/59e4a368-cc78-4a15-a50f-f6023ba19777.jpg,234871707,https://www.airbnb.com/users/show/234871707,Theresa,2019-01-06,,,within an hour,100.0,88%,t,https://a0.muscache.com/im/pictures/user/4f060270-b072-4e75-9bdb-17421a24104f.jpg?aki_policy=profile_small,https://a0.muscache.com/im/pictures/user/4f060270-b072-4e75-9bdb-17421a24104f.jpg?aki_policy=profile_x_medium,Cambridgeport,1,4,['phone'],t,f,Neighborhood highlights,Riverside,,42.365,-71.10831,Entire home,Entire home/apt,10,2.0,2 baths,3.0,5.0,"[""Essentials"", ""Children\u2019s dinnerware"", ""Central air conditioning"", ""Wifi"", ""Self check-in"", ""Bed linens"", ""Freezer"", ""Conditioner"", ""Indoor fireplace: electric"", ""Private patio or balcony"", ""Carbon monoxide alarm"", ""Cleaning products"", ""Laundromat nearby"", ""Outdoor dining area"", ""BBQ grill"", ""Coffee"", ""Coffee maker: drip coffee maker"", ""Bathtub"", ""Body soap"", ""Garden view"", ""Shower gel"", ""Dining table"", ""Wine glasses"", ""Smoke alarm"", ""Keypad"", ""Baking sheet"", ""First aid kit"", ""Free parking on premises"", ""Toaster"", ""Hot water"", ""Refrigerator"", ""Oven"", ""Dedicated workspace"", ""Hangers"", ""Central heating"", ""Dishes and silverware"", ""Blender"", ""Barbecue utensils"", ""Shampoo"", ""Private entrance"", ""Dishwasher"", ""Hot water kettle"", ""Fire pit"", ""Gas stove"", ""Cooking basics"", ""Children\u2019s books and toys"", ""Microwave"", ""Books and reading material"", ""Private backyard \u2013 Fully fenced"", ""Outdoor furniture"", ""Fire extinguisher"", ""Exterior security cameras on property"", ""TV"", ""Exercise equipment: elliptical"", ""Iron"", ""Sound system with aux"", ""Hair dryer"", ""Kitchen""]",$896.00,2,365,2,2,365,365,2.0,365.0,,t,24,50,78,285,2024-12-28,24,12,0,2022-05-24,2024-11-24,4.88,4.71,4.83,4.96,5.0,4.88,4.38,STR-170464,f,1,1,0,0,0.76
629,608303312565390696,https://www.airbnb.com/rooms/608303312565390696,20241228025327,2024-12-28,city scrape,2BR East Cambridge | Free Parking,Welcome to our 2-bedroom condo in the heart of Cambridge.<br />* Free parking (1 car)<br />* Keyless entry<br />* Central A/C<br />* Good WIFI<br />* Smart TV<br />* Street level entrance<br /><br />Walking distance to:<br />* Boynton Yards - 2 min<br />* Inman Square - 8 min<br />* Union Square T station - 10 min<br />* MIT - 14 min<br />* Kendall Square - 19 min<br />* Harvard University - 24 min<br />* Charles River Walk - 24 min<br />* Museum of Science - 25 min,,https://a0.muscache.com/pictures/miso/Hosting-608303312565390696/original/95eb3bcd-1f54-4ba6-a8bf-23aaa7320266.jpeg,175945688,https://www.airbnb.com/users/show/175945688,Ekaterina,2018-02-28,"Cambridge, MA","Hi!

My husband Carl and I have been AirBnB hosts since 2018 and love sharing our homes with kind and respectful guests. 

Music, travel, food, friends and family make me happy. 
Have many years of experience in hospitality management and in leading start-ups.",within a few hours,100.0,86%,t,https://a0.muscache.com/im/pictures/user/cac95925-716a-4725-ab33-222a06ef0420.jpg?aki_policy=profile_small,https://a0.muscache.com/im/pictures/user/cac95925-716a-4725-ab33-222a06ef0420.jpg?aki_policy=profile_x_medium,Wellington-Harrington,4,5,"['email', 'phone', 'work_email']",t,t,,Wellington-Harrington,,42.37311172485352,-71.0915756225586,Entire condo,Entire home/apt,5,1.0,1 bath,2.0,3.0,"[""Essentials"", ""Pack \u2019n play/Travel crib - always at the listing"", ""Wifi"", ""Self check-in"", ""Free driveway parking on premises \u2013 1 space"", ""Bed linens"", ""Freezer"", ""Conditioner"", ""Private patio or balcony"", ""Carbon monoxide alarm"", ""Washer \u2013\u00a0In building"", ""Body soap"", ""Drying rack for clothing"", ""Shower gel"", ""Dining table"", ""Wine glasses"", ""Smoke alarm"", ""Coffee maker: Keurig coffee machine"", ""TV with Amazon Prime Video, Netflix, Roku"", ""First aid kit"", ""Smart lock"", ""Toaster"", ""Hot water"", ""Refrigerator"", ""Oven"", ""Clothing storage: closet"", ""Dedicated workspace"", ""Free dryer \u2013 In building"", ""Hangers"", ""Central heating"", ""Dishes and silverware"", ""Private entrance"", ""Shampoo"", ""Dishwasher"", ""Extra pillows and blankets"", ""Hot water kettle"", ""Long term stays allowed"", ""Gas stove"", ""Cooking basics"", ""Microwave"", ""Air conditioning"", ""Outdoor furniture"", ""Fire extinguisher"", ""Exterior security cameras on property"", ""Iron"", ""Hair dryer"", ""Kitchen""]",$263.00,2,90,2,2,90,90,2.0,90.0,,t,28,58,88,171,2024-12-28,18,18,0,2024-07-14,2024-11-24,4.89,4.89,4.83,5.0,5.0,4.83,4.72,STR-172992,f,1,1,0,0,3.21
633,610907392915480050,https://www.airbnb.com/rooms/610907392915480050,20241228025327,2024-12-28,city scrape,"Updated 3 Room Apartment, King bed","Spacious first-floor apartment in a Cambridge two-family house. King-size purple mattress, fully stocked kitchen, living room/office. Full Alexa automation lights and locks. Bikes available with locks and helmets.<br />Located in a great neighborhood a few blocks from the river, public transportation(Buses, Red and Green Line trains), and grocery stores.<br />Walking distance to MIT, Harvard, BU, Cambridge central square, and Boston.<br /><br />Bikes with a helmet and lock are available during your stay.",,https://a0.muscache.com/pictures/miso/Hosting-610907392915480050/original/0037d0a5-e2a5-4541-8d39-33d42bef4ac6.jpeg,6030020,https://www.airbnb.com/users/show/6030020,Jason,2013-04-21,"Cambridge, MA","I'm a software dev who has lived in Cambridge for many years & love all my town offers

Happy to offer local recommendations:
bike trails, kayaking & other outdoor activities (especially nature outings — the Charles River is 3 blocks away!), whale watching, comedy, museums, cultural events

You're also welcome to use my fleet of renovated bikes for exploring, free of charge

I’m always reachable for anything that will make your stay comfortable",within an hour,100.0,85%,t,https://a0.muscache.com/im/pictures/user/User-6030020/original/0cf68826-ee26-4deb-b6a0-c21055204f75.jpeg?aki_policy=profile_small,https://a0.muscache.com/im/pictures/user/User-6030020/original/0cf68826-ee26-4deb-b6a0-c21055204f75.jpeg?aki_policy=profile_x_medium,Cambridge,5,7,"['email', 'phone']",t,t,,Cambridgeport,,42.35842,-71.1107,Entire rental unit,Entire home/apt,5,1.0,1 bath,2.0,1.0,"[""Essentials"", ""Samsung stainless steel oven"", ""Ethernet connection"", ""Self check-in"", ""Bed linens"", ""Freezer"", ""Conditioner"", ""Bikes"", ""Ceiling fan"", ""Carbon monoxide alarm"", ""Cleaning products"", ""Laundromat nearby"", ""Outdoor dining area"", ""BBQ grill"", ""Single level home"", ""60 inch HDTV with Chromecast"", ""Coffee maker: drip coffee maker"", ""Housekeeping - included with your stay"", ""Bathtub"", ""Body soap"", ""Drying rack for clothing"", ""Dining table"", ""Wine glasses"", ""Smoke alarm"", ""Paid parking garage off premises"", ""Baking sheet"", ""Luggage dropoff allowed"", ""Bidet"", ""Smart lock"", ""Toaster"", ""Radiant heating"", ""Bluetooth sound system"", ""Portable fans"", ""Hot water"", ""GE refrigerator"", ""Clothing storage: closet"", ""Samsung stainless steel gas stove"", ""Dedicated workspace"", ""Rice maker"", ""Room-darkening shades"", ""Hangers"", ""Dishes and silverware"", ""Exercise equipment: yoga mat"", ""Blender"", ""Shampoo"", ""Barbecue utensils"", ""Dishwasher"", ""Extra pillows and blankets"", ""Hot water kettle"", ""Private entrance"", ""Shared patio or balcony"", ""Long term stays allowed"", ""Free dryer \u2013 In unit"", ""Beach essentials"", ""Cooking basics"", ""Shared backyard \u2013 Not fully fenced"", ""Microwave"", ""Air conditioning"", ""Kayak"", ""Outdoor furniture"", ""Fire extinguisher"", ""Free washer \u2013 In unit"", ""Exterior security cameras on property"", ""Board games"", ""Fast wifi \u2013 117 Mbps"", ""Iron"", ""Hair dryer"", ""Kitchen""]",$600.00,21,730,21,21,730,730,21.0,730.0,,t,23,53,83,358,2024-12-28,6,2,0,2022-11-08,2024-09-20,5.0,4.83,4.67,4.83,4.83,4.83,4.33,,f,5,1,4,0,0.23
637,615906806974486700,https://www.airbnb.com/rooms/615906806974486700,20241228025327,2024-12-28,city scrape,Cambridge Apartment,"Cozy two bedroom apartment in the heart of Cambridge’s Inman Square. The apartment is above a beautiful Irish bar and is surrounded by local restaurants and dozens of locally-owned businesses.  It’s a 5 minute walk to the new green line extension in Union Square , a 10 minute walk to the Central Square red line and a 15 walk to Harvard University.<br />TD garden is 5 stops away on the green line and 6 stops to Faneuil Hall and downtown Boston.Logan Airport is 15 minutes by car.","Inman Square is a quiet and safe area of Cambridge with plenty of local restaurants, bars and shops.  Its close proximity to Harvard University and Boston make it an ideal location to set up base.",https://a0.muscache.com/pictures/e33a4a2e-e7c7-4863-a869-9d3d0cbcb22f.jpg,168766712,https://www.airbnb.com/users/show/168766712,Ciarán,2018-01-19,"Cambridge, MA",,within an hour,100.0,100%,f,https://a0.muscache.com/im/pictures/user/User-168766712/original/0d80389c-3f6f-4d74-981c-e52a02904d1c.jpeg?aki_policy=profile_small,https://a0.muscache.com/im/pictures/user/User-168766712/original/0d80389c-3f6f-4d74-981c-e52a02904d1c.jpeg?aki_policy=profile_x_medium,Inman Square,1,2,"['email', 'phone']",t,t,Neighborhood highlights,Wellington-Harrington,,42.37232,-71.09756,Entire serviced apartment,Entire home/apt,8,1.0,1 bath,2.0,5.0,"[""Essentials"", ""Children\u2019s dinnerware"", ""Ethernet connection"", ""Bed linens"", ""Host greets you"", ""Conditioner"", ""Window AC unit"", ""Carbon monoxide alarm"", ""Cleaning products"", ""Laundromat nearby"", ""Paid street parking off premises"", ""High chair"", ""Fast wifi \u2013 413 Mbps"", ""Free washer \u2013 In building"", ""Coffee"", ""Bathtub"", ""Body soap"", ""Stainless steel oven"", ""Shower gel"", ""Pets allowed"", ""Wine glasses"", ""Smoke alarm"", ""Coffee maker: Keurig coffee machine"", ""55 inch HDTV with Netflix"", ""Pack \u2019n play/Travel crib"", ""First aid kit"", ""Free parking on premises"", ""Luggage dropoff allowed"", ""Toaster"", ""Portable fans"", ""Hot water"", ""Refrigerator"", ""Clothing storage: closet"", ""Dedicated workspace"", ""Room-darkening shades"", ""Hangers"", ""Free dryer \u2013 In building"", ""Central heating"", ""Dishes and silverware"", ""Private entrance"", ""Shampoo"", ""Extra pillows and blankets"", ""Long term stays allowed"", ""City skyline view"", ""Cooking basics"", ""Children\u2019s books and toys"", ""Microwave"", ""Stainless steel gas stove"", ""Fire extinguisher"", ""Iron"", ""Hair dryer"", ""Kitchen""]",$285.00,2,730,2,2,730,730,2.0,730.0,,t,30,60,88,291,2024-12-28,26,9,1,2023-01-05,2024-12-01,4.58,4.73,4.73,4.85,4.88,4.96,4.54,C0399460491,f,1,1,0,0,1.08
638,618155510192385373,https://www.airbnb.com/rooms/618155510192385373,20241228025327,2024-12-28,previous scrape,Ideal location parking Harvard mansion 4+br 3.5 ba,"Experience the best of Boston: a luxurious blend of historic elegance and modern convenience in the spacious original wing of a Victorian mansion.<br /><br />The Cambridge Cosmopolitan is ideally located on a lovely side street near the red line T, restaurants, & shops; walk to Harvard (10 - 15 min), easy access to Kendall/MIT, MGH, & downtown Boston.<br /><br />Visit, work, or play with ample space to gather as a group or to relax in privacy in expansive bedrooms and grand living rooms.<br /><br />Free parking, no smoking","Ideally located on a charming tree-lined street of historic homes in the central Baldwin (fka Agassiz) neighborhood. This area has a welcoming mix of decades-long residents, newcomers, and visitors;  professors, professionals, families, artists, writers, and scholars. We are very close to Harvard and Lesley University, and within easy access of MIT, Tufts, and many other colleges and universities.",https://a0.muscache.com/pictures/hosting/Hosting-U3RheVN1cHBseUxpc3Rpbmc6NjE4MTU1NTEwMTkyMzg1Mzcz/original/dc1bdac3-cdad-4123-9d81-5f332a1539b5.jpeg,115369531,https://www.airbnb.com/users/show/115369531,V,2017-02-07,"Cambridge, MA","Originally from a place long ago and far away, I've lived and worked on three continents and have been based in Cambridge MA for over 20 years.",within an hour,100.0,100%,t,https://a0.muscache.com/im/pictures/user/User/original/aa578673-efec-4221-91d6-ec6823d7a48e.jpeg?aki_policy=profile_small,https://a0.muscache.com/im/pictures/user/User/original/aa578673-efec-4221-91d6-ec6823d7a48e.jpeg?aki_policy=profile_x_medium,Agassiz,2,2,"['email', 'phone', 'work_email']",t,f,Neighborhood highlights,Agassiz,,42.38511,-71.11804,Entire home,Entire home/apt,10,,3.5 baths,5.0,,"[""Essentials"", ""Children\u2019s dinnerware"", ""Wifi"", ""Ethernet connection"", ""Free street parking"", ""Self check-in"", ""Free driveway parking on premises \u2013 1 space"", ""Bed linens"", ""Freezer"", ""Conditioner"", ""55 inch HDTV with Roku"", ""Carbon monoxide alarm"", ""Cleaning products"", ""Laundromat nearby"", ""Theme room"", ""Free washer \u2013 In building"", ""Stainless steel induction stove"", ""Coffee"", ""Bathtub"", ""Body soap"", ""Drying rack for clothing"", ""Shower gel"", ""Dining table"", ""Wine glasses"", ""Smoke alarm"", ""Clothing storage: walk-in closet and closet"", ""Keypad"", ""Baking sheet"", ""First aid kit"", ""Toaster"", ""Portable fans"", ""Backyard - Not fully fenced"", ""Cleaning available during stay"", ""Hot water"", ""Refrigerator"", ""Oven"", ""Rice maker"", ""Standalone high chair - available upon request"", ""Children\u2019s books and toys for ages 0-2 years old, 2-5 years old, 5-10 years old, and 10+ years old"", ""Dedicated workspace"", ""Room-darkening shades"", ""Hangers"", ""Free dryer \u2013 In building"", ""Central heating"", ""Dishes and silverware"", ""Exercise equipment: yoga mat"", ""Blender"", ""Shampoo"", ""Private entrance"", ""Dishwasher"", ""Extra pillows and blankets"", ""Hot water kettle"", ""Long term stays allowed"", ""Cooking basics"", ""Microwave"", ""Coffee maker: drip coffee maker, french press, Keurig coffee machine, Nespresso"", ""Books and reading material"", ""Fire extinguisher"", ""AC - split type ductless system"", ""Exterior security cameras on property"", ""Board games"", ""Iron"", ""Hair dryer"", ""Kitchen""]",,2,27,2,3,27,27,2.8,27.0,,t,27,57,85,259,2024-12-28,61,26,2,2022-10-10,2024-12-15,4.98,4.98,4.98,4.98,4.98,5.0,4.89,STR-189286,f,1,1,0,0,2.26
