937,989834256527627698,https://www.airbnb.com/rooms/989834256527627698,20241228025327,2024-12-28,previous scrape,Lux 2BR Apartment w/ Amenities,"Watermark Kendall East is a spacious apartment in a flourishing neighborhood with a modern style. Living in Kendall Square is convenient and unique with culture. <br /><br />Located amongst tech companies and MIT facilities Kendall Square is an innovation hub. Between museums, cafes,  restaurants, and shops there is lots to explore. Take advantage of being by the water and walk along the Charles River or rent a kayak!","Cambridge is rich with fine dining, culture, art, theatre, and a range of shops. Kendall Square is growing into an exciting community of apartments, offices, shops, and restaurants.<br /><br />Show off your skating skills on the 8,400 sq. ft. ice skating rink in the winter or gather in open plazas for concerts, lunch, or farmer’s markets in the summer.<br /><br />Go shopping, grab a bite to eat, or walk alongside the Charles River.",https://a0.muscache.com/pictures/miso/Hosting-989834256527627698/original/23991c13-4042-40ce-adbc-6f7ca96ebbb6.png,20857768,https://www.airbnb.com/users/show/20857768,Compass,2014-09-02,"Boston, MA","Welcome to your home away from home! 
My name is Adam with Compass Furnished Apartments.

We have 450+ furnished apartments throughout the Northeast. Our portfolio offers options for most budgets and needs 

Our apartments are move in ready, and come with high speed internet, high quality furnishings, and full kitchens with housewares to support quick trips or long term business stays, all you need to bring is your suitcase!",within a few hours,100.0,52%,t,https://a0.muscache.com/im/pictures/user/d323e808-7012-4c64-a95c-26ba3a3c0473.jpg?aki_policy=profile_small,https://a0.muscache.com/im/pictures/user/d323e808-7012-4c64-a95c-26ba3a3c0473.jpg?aki_policy=profile_x_medium,North End,49,115,"['email', 'phone', 'work_email']",t,t,Neighborhood highlights,East Cambridge,,42.3634946,-71.0823684,Entire serviced apartment,Entire home/apt,5,,2 baths,2.0,,"[""Essentials"", ""Wifi"", ""Building staff"", ""Self check-in"", ""Bed linens"", ""Conditioner"", ""Paid parking garage on premises \u2013 1 space"", ""Carbon monoxide alarm"", ""Cleaning products"", ""Outdoor dining area"", ""BBQ grill"", ""Bathtub"", ""Body soap"", ""Pets allowed"", ""Smoke alarm"", ""Dryer \u2013\u00a0In unit"", ""Hot water"", ""Dedicated workspace"", ""Hangers"", ""Central heating"", ""Dishes and silverware"", ""Shampoo"", ""Long term stays allowed"", ""Cooking basics"", ""Air conditioning"", ""Clothing storage: closet and dresser"", ""Washer"", ""TV"", ""Iron"", ""Exercise equipment"", ""Hair dryer"", ""Kitchen""]",,29,365,29,29,365,365,29.0,365.0,,t,0,0,0,0,2024-12-28,0,0,0,,,,,,,,,,,f,6,6,0,0,
938,990127857931944993,https://www.airbnb.com/rooms/990127857931944993,20241228025327,2024-12-28,city scrape,"2Bed, 1.5Bath, Multi-Level Townhouse, Sleeps 6","Location, location, location! This multi-level townhouse is just minutes from Harvard Business School, the Red Line, and Central Square, with easy access to MIT, Longwood Medical hospitals, universities, Harvard, Kendall Square, and Inman Square.","Riverside is a residential neighborhood located along the Charles River, which includes some of the oldest settled parts of Cambridge. Harvard Square and Central Square, both major commercial and transit centers, lie at either end of the neighborhood. Massachusetts Avenue, which connects the two squares, serves as the neighborhood’s retail. Smaller commercial areas exist along Putnam Avenue, Western Avenue and River Street. Much of Harvard University’s student housing is located in Riverside. Riverside is also home to some of Harvard’s academic facilities and the primary academic and administrative facility for Cambridge College Riverside is a neighborhood in Cambridge, Massachusetts with a population of 12,181. Riverside is in Middlesex County and is one of the best places to live in Massachusetts. Living in Riverside offers residents a dense urban feel and most residents rent their homes. In Riverside there are a lot of bars, restaurants, coffee shops, and parks. Many young professio",https://a0.muscache.com/pictures/prohost-api/Hosting-990127857931944993/original/d15f2c1d-653c-4979-9be7-a7ee1f53734e.jpeg,31340713,https://www.airbnb.com/users/show/31340713,Kama,2015-04-16,"Boston, MA","Welcome to STARS of Boston (Short Term Apartment Rental Solutions) -- our name says it all! We offer stylishly furnished and accessorized apartments as superior value alternatives to hotels. Our private rooms, studio, one, two, three & four bedroom apartments and homes have been carefully curated to provide a refuge for work, play or rejuvenation. 
STARS offers flexible term stays in the most desirable areas around Greater Boston, Brookline, Longwood Medical Area, most major universities and Cambridge. Our units are pet friendly and accessible by public transit or order up VIP service for airport transfers, a personal driver or pet and child care. Special request? We’ll gladly check into it. We’d love to host you, just call or email us for best rates and availability. I was born and raised in Greater Boston and work in real estate in Brookline for 17 years and counting.
",within an hour,100.0,92%,f,https://a0.muscache.com/im/pictures/user/0d987cb1-43f8-466d-9e7e-735922c6ba17.jpg?aki_policy=profile_small,https://a0.muscache.com/im/pictures/user/0d987cb1-43f8-466d-9e7e-735922c6ba17.jpg?aki_policy=profile_x_medium,Allston-Brighton,102,161,"['email', 'phone']",t,t,Neighborhood highlights,Riverside,,42.364270127391464,-71.109489797575,Entire rental unit,Entire home/apt,6,1.5,1.5 baths,2.0,2.0,"[""Paid parking on premises"", ""Essentials"", ""Shared BBQ grill: gas"", ""Central air conditioning"", ""Wifi"", ""Self check-in"", ""Bed linens"", ""Freezer"", ""Conditioner"", ""Carbon monoxide alarm"", ""Cleaning products"", ""Outdoor dining area"", ""Coffee"", ""Coffee maker: drip coffee maker"", ""Bathtub"", ""Body soap"", ""Pets allowed"", ""Shower gel"", ""Dining table"", ""Paid dryer \u2013 In building"", ""Wine glasses"", ""Smoke alarm"", ""Keypad"", ""Baking sheet"", ""Luggage dropoff allowed"", ""Toaster"", ""Portable fans"", ""Cleaning available during stay"", ""Hot water"", ""Refrigerator"", ""Oven"", ""Standalone high chair - available upon request"", ""Dedicated workspace"", ""Hangers"", ""Central heating"", ""Dishes and silverware"", ""Blender"", ""Shampoo"", ""Extra pillows and blankets"", ""Hot water kettle"", ""Long term stays allowed"", ""Gas stove"", ""Pack \u2019n play/Travel crib - available upon request"", ""Cooking basics"", ""Microwave"", ""Clothing storage: closet and dresser"", ""Fire extinguisher"", ""Washer"", ""TV"", ""Iron"", ""Hair dryer"", ""Kitchen""]",$131.00,4,1125,3,29,1125,1125,27.6,1125.0,,t,29,59,78,327,2024-12-28,14,10,1,2023-11-04,2024-11-30,4.86,4.86,4.71,4.93,4.93,4.93,4.57,,f,8,8,0,0,1.0
941,991486135625844125,https://www.airbnb.com/rooms/991486135625844125,20241228025327,2024-12-28,city scrape,"2Bed, 1.5Bath, Multi-Level Townhouse, Sleeps 6","Location, location, location! This multi-level townhouse is just minutes from Harvard Business School, the Red Line, and Central Square, with easy access to MIT, Longwood Medical hospitals, universities, Harvard, Kendall Square, and Inman Square.",,https://a0.muscache.com/pictures/miso/Hosting-991486135625844125/original/82937524-44bd-4afe-8a82-90a5a43a7a7c.jpeg,266312920,https://www.airbnb.com/users/show/266312920,STARS Of,2019-06-04,"Boston, MA","Welcome to STARS of Boston (Short Term Apartment Rental Solutions) -- our name says it all! We offer stylishly furnished and accessorized apartments as superior value alternatives to hotels. Our private rooms, studio, one, two, three & four bedroom apartments and homes have been carefully curated to provide a refuge for work, play or rejuvenation. 
STARS offers flexible term stays in the most desirable areas around Greater Boston, Brookline, Longwood Medical Area, most major universities and Cambridge. Our units are pet friendly and accessible by public transit or order up VIP service for airport transfers, a personal driver or pet and child care. Special request? We’ll gladly check into it. We’d love to host you, just call or email us for best rates and availability. ",within an hour,100.0,89%,f,https://a0.muscache.com/im/pictures/user/70077bc0-c203-4eed-b154-cf523c514acc.jpg?aki_policy=profile_small,https://a0.muscache.com/im/pictures/user/70077bc0-c203-4eed-b154-cf523c514acc.jpg?aki_policy=profile_x_medium,Brookline,79,135,"['email', 'phone', 'work_email']",t,t,,Riverside,,42.364337481609134,-71.10969552788434,Entire rental unit,Entire home/apt,6,1.5,1.5 baths,2.0,2.0,"[""Paid parking on premises"", ""Essentials"", ""Wifi"", ""Self check-in"", ""Bed linens"", ""Freezer"", ""Conditioner"", ""Carbon monoxide alarm"", ""Cleaning products"", ""Heating"", ""Stove"", ""Coffee"", ""Bathtub"", ""Body soap"", ""Dryer"", ""Shower gel"", ""Dining table"", ""Pets allowed"", ""Wine glasses"", ""Smoke alarm"", ""Keypad"", ""Baking sheet"", ""Pack \u2019n play/Travel crib"", ""Toaster"", ""Portable fans"", ""Hot water"", ""Refrigerator"", ""Oven"", ""Dedicated workspace"", ""Hangers"", ""Crib"", ""Coffee maker"", ""Dishes and silverware"", ""Blender"", ""Shampoo"", ""Extra pillows and blankets"", ""Hot water kettle"", ""Cooking basics"", ""Clothing storage"", ""Microwave"", ""Air conditioning"", ""Fire extinguisher"", ""TV"", ""Iron"", ""Hair dryer"", ""Kitchen""]",$197.00,4,1125,28,28,1125,1125,28.0,1125.0,,t,29,59,78,326,2024-12-28,4,4,0,2024-07-07,2024-10-29,4.5,4.5,5.0,4.75,4.25,4.25,4.5,,f,9,9,0,0,0.69
943,994346837966557081,https://www.airbnb.com/rooms/994346837966557081,20241228025327,2024-12-28,city scrape,Central Penthouse Harvard MIT Spacious Gym & Work,"This special place is close to everything, making it easy to plan your visit our 2 Bedroom | 2Bathroom Luxurious apartment is located in Central Cambridge Kendall Square, one of the most exciting places to live, work, shop & play in the Boston/Cambridge area. At this community, there is an array of amenities such as a mezzanine terrace with a garden, fitness center, business center and more. <br /><br />**Ask us about our unbeatable monthly rates!**.","Located in Cambridge, MA, Kendall Square is an internationally recognized innovation district that is propelled by the synergies of imagination and ingenuity. Join us as we continue to collaborate and problem solve by leveraging the best of what our innovation community has to offer.",https://a0.muscache.com/pictures/miso/Hosting-994346837966557081/original/20f017ca-71f6-4d02-a9a3-cacc8d96da60.jpeg,463475392,https://www.airbnb.com/users/show/463475392,Haroldo,2022-06-09,"Michigan Center, MI","Short Term Rental Broker Company: **Mass Living**

We are Johna & Humberto; Founders of ""Mass Living"", a property management company that provides customer support and luxury rentals in Boston and Cambridge. We connect you with corporate housing companies (We don't host ourselves). Our goal is to enhance your short term accommodation/trip!

We speak 7 different languages; English, Chinese, Spanish, French, Portuguese, Turkish and Italian.",within an hour,100.0,100%,t,https://a0.muscache.com/im/pictures/user/User/original/ae7bad4b-e256-4158-9150-7d4f4d39968e.jpeg?aki_policy=profile_small,https://a0.muscache.com/im/pictures/user/User/original/ae7bad4b-e256-4158-9150-7d4f4d39968e.jpeg?aki_policy=profile_x_medium,Chinatown,36,40,"['email', 'phone']",t,t,Neighborhood highlights,The Port,,42.3638649,-71.10042729999999,Entire rental unit,Entire home/apt,7,2.0,2 baths,2.0,5.0,"[""Paid parking on premises"", ""Fireplace guards"", ""BBQ grill"", ""Coffee"", ""Body soap"", ""Pack \u2019n play/Travel crib"", ""Bidet"", ""Luggage dropoff allowed"", ""Bosch stainless steel single oven"", ""Rice maker"", ""Central heating"", ""Dishes and silverware"", ""Long term stays allowed"", ""Free dryer \u2013 In unit"", ""Children\u2019s books and toys"", ""Microwave"", ""Outdoor furniture"", ""Board games"", ""Exercise equipment"", ""Outdoor dining area"", ""Game console"", ""Free residential garage on premises"", ""Free street parking"", ""Baby bath"", ""Bed linens"", ""Children's playroom"", ""Cleaning products"", ""High chair"", ""Single level home"", ""Bathtub"", ""Shower gel"", ""Safe"", ""First aid kit"", ""Cleaning available during stay"", ""Hot water"", ""Hangers"", ""Dishwasher"", ""Hot water kettle"", ""Cooking basics"", ""Clothing storage"", ""Bread maker"", ""Trash compactor"", ""Fire extinguisher"", ""Free washer \u2013 In unit"", ""Hair dryer"", ""Arcade games"", ""Self check-in"", ""Freezer"", ""Babysitter recommendations"", ""Mini fridge"", ""Drying rack for clothing"", ""Bosch stainless steel electric stove"", ""Wine glasses"", ""Lake access"", ""Changing table"", ""Pool table"", ""Room-darkening shades"", ""Bosch refrigerator"", ""Blender"", ""Shampoo"", ""Waterfront"", ""Extra pillows and blankets"", ""Books and reading material"", ""Outdoor playground"", ""Iron"", ""Essentials"", ""Children\u2019s dinnerware"", ""Central air conditioning"", ""Ethernet connection"", ""Wifi"", ""Shared gym in building"", ""Elevator"", ""Conditioner"", ""Outdoor kitchen with oven, sink"", ""Carbon monoxide alarm"", ""Laundromat nearby"", ""Pets allowed"", ""Dining table"", ""Smoke alarm"", ""Keypad"", ""Coffee maker: Keurig coffee machine"", ""Baby monitor"", ""Shared backyard \u2013 Fully fenced"", ""Children\u2019s bikes"", ""Crib"", ""Barbecue utensils"", ""EV charger"", ""TV"", ""Private hot tub"", ""Kitchen""]",$333.00,1,180,1,3,1125,1125,2.1,1125.0,,t,25,48,78,78,2024-12-28,39,36,2,2023-10-16,2024-12-13,4.85,4.82,4.9,4.85,4.77,5.0,4.72,,t,22,22,0,0,2.66
944,994958540516980415,https://www.airbnb.com/rooms/994958540516980415,20241228025327,2024-12-28,city scrape,Lux 2BR w/ Amenities,"Ultra modern 2 bedroom apartment located in the heart of Kendall Square. The apartment includes custom furnishings, laundry in unit, and access to all the great on site amenities at Proto including 24h concierge and fitness center.","Cambridge is an entrepreneurial hub with endless start-ups within blocks. Cambridge is an easy commute with fine dinning, art, and a range of shops to explore. <br /><br />Kendall Square continues to grow into a busy community of apartments, offices, shops , and restaurants. <br /><br />Show off your skating skills on the 8,400 sq. ft. ice skating rink in the winter or gather in open plazas for concerts, lunch, or farmer's markets in the summer.",https://a0.muscache.com/pictures/miso/Hosting-994958540516980415/original/a8797959-94cb-42c6-9898-c63045f401ef.jpeg,20857768,https://www.airbnb.com/users/show/20857768,Compass,2014-09-02,"Boston, MA","Welcome to your home away from home! 
My name is Adam with Compass Furnished Apartments.

We have 450+ furnished apartments throughout the Northeast. Our portfolio offers options for most budgets and needs 

Our apartments are move in ready, and come with high speed internet, high quality furnishings, and full kitchens with housewares to support quick trips or long term business stays, all you need to bring is your suitcase!",within a few hours,100.0,52%,t,https://a0.muscache.com/im/pictures/user/d323e808-7012-4c64-a95c-26ba3a3c0473.jpg?aki_policy=profile_small,https://a0.muscache.com/im/pictures/user/d323e808-7012-4c64-a95c-26ba3a3c0473.jpg?aki_policy=profile_x_medium,North End,49,115,"['email', 'phone', 'work_email']",t,t,Neighborhood highlights,Area 2/MIT,,42.363145,-71.0878918,Entire serviced apartment,Entire home/apt,5,2.0,2 baths,2.0,2.0,"[""Paid parking on premises"", ""Essentials"", ""Game console"", ""Wifi"", ""Shared gym in building"", ""Self check-in"", ""Building staff"", ""Elevator"", ""Bed linens"", ""Freezer"", ""Conditioner"", ""Carbon monoxide alarm"", ""Cleaning products"", ""BBQ grill"", ""Heating"", ""Stove"", ""Coffee maker: drip coffee maker"", ""Body soap"", ""Coffee"", ""Pets allowed"", ""Ping pong table"", ""Wine glasses"", ""Smoke alarm"", ""Baking sheet"", ""Hot water"", ""Refrigerator"", ""Oven"", ""Dedicated workspace"", ""Hangers"", ""Dishes and silverware"", ""Shampoo"", ""Fire pit"", ""Long term stays allowed"", ""Free dryer \u2013 In unit"", ""Cooking basics"", ""Clothing storage"", ""Microwave"", ""Air conditioning"", ""Washer"", ""TV"", ""Iron"", ""Exercise equipment"", ""Hair dryer"", ""Kitchen""]",$299.00,29,365,29,29,365,365,29.0,365.0,,t,28,58,88,178,2024-12-28,0,0,0,,,,,,,,,,,f,6,6,0,0,
947,998582507525458740,https://www.airbnb.com/rooms/998582507525458740,20241228025327,2024-12-28,city scrape,"Near MIT, Harvard & Central Square Transit & Shops","You're renting a 3 bedroom apartment near Central Square. This is a very walkable area and has great transit links. A perfect location near some of the world's most coveted institutions.<br /><br />This apartment is near:<br />*MIT, Harvard & Charles River<br />*Kendall Square biotech, mall, and shops<br />*Central Square<br />*Red Line Subway Stop<br />*Parks<br />*Grocery Stores<br /><br />This apartment has:<br />*Queen beds<br />*Individual Workspaces<br />*High speed wifi<br />*TV in each bedroom<br />*Bedroom Doors Lock<br />*Laundry Service<br /><br />ID required after booking",,https://a0.muscache.com/pictures/miso/Hosting-998582507525458740/original/fb57abca-200d-4825-adcd-e13fa829a329.jpeg,43450256,https://www.airbnb.com/users/show/43450256,Steve,2015-09-05,"Cambridge, MA",,within an hour,88.0,59%,f,https://a0.muscache.com/im/users/43450256/profile_pic/1441495503/original.jpg?aki_policy=profile_small,https://a0.muscache.com/im/users/43450256/profile_pic/1441495503/original.jpg?aki_policy=profile_x_medium,Cambridge,124,180,"['email', 'phone']",t,t,,The Port,,42.36624,-71.09901,Entire rental unit,Entire home/apt,6,1.0,1 bath,3.0,3.0,"[""Essentials"", ""Wifi"", ""Self check-in"", ""Bed linens"", ""Freezer"", ""Window AC unit"", ""Carbon monoxide alarm"", ""Cleaning products"", ""Laundromat nearby"", ""Heating"", ""Stove"", ""Coffee maker: drip coffee maker"", ""Shower gel"", ""Dining table"", ""Wine glasses"", ""Smoke alarm"", ""Keypad"", ""Baking sheet"", ""Toaster"", ""Hot water"", ""Refrigerator"", ""Oven"", ""Dedicated workspace"", ""Hangers"", ""Paid parking off premises"", ""Dishes and silverware"", ""Private entrance"", ""Shampoo"", ""Dishwasher"", ""Hot water kettle"", ""Long term stays allowed"", ""Clothing storage"", ""Microwave"", ""TV"", ""Iron"", ""Hair dryer"", ""Kitchen""]",$111.00,30,365,30,30,365,365,30.0,365.0,,t,0,0,1,182,2024-12-28,1,1,0,2024-08-08,2024-08-08,5.0,5.0,5.0,5.0,5.0,5.0,5.0,,f,61,30,31,0,0.21
958,1010125409177601423,https://www.airbnb.com/rooms/1010125409177601423,20241228025327,2024-12-28,city scrape,"Comfy Condo w/River View, Shared Gym, King Bed","Experience modern comfort in your next condo retreat with city skyline and river views from each window. The 60"" HDTV with Roku invites cozy evenings, while a fully equipped kitchen and stylish dining area cater to culinary delights. King and queen, and twin bedrooms w/restful nights. The building shared amenities include an invigorating gym, inspiring meeting rooms, and welcoming seating areas. Set in Cambridge, explore nearby top attractions!<br /><br />✔ Shared Gym<br />✔ River Views<br />✔ Elevators<br />✔ King Bed","Nestled at Cambridge, this penthouse retreat promises an unparalleled experience with its breathtaking panoramas of the Boston skyline and the meandering Charles River. This luxurious 3-bedroom plus den penthouse apartment is strategically located, offering swift access within 5 to 10 minutes to key destinations, including Kendall/MIT, Harvard Square, Downtown Boston, Back Bay, Beacon Hill, Seaport District, Logan International Airport, Longwood Medical Center & MGH, and Boston Medical Center, Tufts Medical Center.<br /><br />Top 5 Attractions Nearby (by car in minutes):<br /><br />✔ Fenway Park - 10 minutes<br />✔ Museum of Science - 7 minutes<br />✔ Boston Common - 8 minutes<br />✔ Harvard Art Museums - 10 minutes<br />✔ New England Aquarium - 12 minutes<br /><br /><br />Top 3 Restaurants Nearby (by car in minutes):<br /><br />✔ The Helmand - 4 minutes<br />✔ Tatte Bakery & Cafe - 2 minutes<br />✔ Oleana - 6 minutes",https://a0.muscache.com/pictures/hosting/Hosting-U3RheVN1cHBseUxpc3Rpbmc6MTAxMDEyNTQwOTE3NzYwMTQyMw%3D%3D/original/062bfd26-7ebc-41b7-8416-4ed44b8a00f3.jpeg,463475392,https://www.airbnb.com/users/show/463475392,Haroldo,2022-06-09,"Michigan Center, MI","Short Term Rental Broker Company: **Mass Living**

We are Johna & Humberto; Founders of ""Mass Living"", a property management company that provides customer support and luxury rentals in Boston and Cambridge. We connect you with corporate housing companies (We don't host ourselves). Our goal is to enhance your short term accommodation/trip!

We speak 7 different languages; English, Chinese, Spanish, French, Portuguese, Turkish and Italian.",within an hour,100.0,100%,t,https://a0.muscache.com/im/pictures/user/User/original/ae7bad4b-e256-4158-9150-7d4f4d39968e.jpeg?aki_policy=profile_small,https://a0.muscache.com/im/pictures/user/User/original/ae7bad4b-e256-4158-9150-7d4f4d39968e.jpeg?aki_policy=profile_x_medium,Chinatown,36,40,"['email', 'phone']",t,t,Neighborhood highlights,East Cambridge,,42.36375,-71.08472,Entire rental unit,Entire home/apt,8,2.0,2 baths,3.0,6.0,"[""Game console: PS5"", ""Paid parking garage on premises \u2013 1 space"", ""Fireplace guards"", ""Coffee"", ""Paid parking garage off premises"", ""Luggage dropoff allowed"", ""Bidet"", ""Exercise equipment: elliptical, free weights, stationary bike, treadmill, yoga mat, workout bench, rowing"", ""Rice maker"", ""Clothing storage: walk-in closet, closet, and dresser"", ""Central heating"", ""Dishes and silverware"", ""Fire pit"", ""Long term stays allowed"", ""Free dryer \u2013 In unit"", ""Microwave"", ""Lux body soap"", ""Outdoor dining area"", ""Pack \u2019n play/Travel crib - always at the listing"", ""Lux conditioner"", ""Free street parking"", ""Free parking garage on premises \u2013 1 space"", ""Bed linens"", ""Children's playroom"", ""Cleaning products"", ""Bathtub"", ""Shower gel"", ""Breakfast"", ""60 inch HDTV with Roku"", ""Safe"", ""First aid kit"", ""Cleaning available during stay"", ""Hot water"", ""Hangers"", ""Dishwasher"", ""Hot water kettle"", ""5 stainless steel single oven"", ""Baby monitor - available upon request"", ""Cooking basics"", ""Trash compactor"", ""Fire extinguisher"", ""Free washer \u2013 In unit"", ""Hair dryer"", ""Freezer"", ""Host greets you"", ""Babysitter recommendations"", ""Bosch stainless steel electric stove"", ""Wine glasses"", ""Lake access"", ""Crib - always at the listing"", ""EV charger - level 1"", ""Refrigerator"", ""Pool table"", ""Room-darkening shades"", ""Blender"", ""Waterfront"", ""Extra pillows and blankets"", ""City skyline view"", ""Ocean view"", ""Outdoor playground"", ""Iron"", ""Essentials"", ""Lux shampoo"", ""Central air conditioning"", ""Wifi"", ""Shared gym in building"", ""Canal view"", ""Elevator"", ""Carbon monoxide alarm"", ""Pets allowed"", ""Dining table"", ""Baby bath - available upon request"", ""Smoke alarm"", ""Coffee maker: Keurig coffee machine"", ""Toaster"", ""Shared backyard \u2013 Fully fenced"", ""Dedicated workspace"", ""Barbecue utensils"", ""Shared patio or balcony"", ""Shared BBQ grill: electric"", ""River view"", ""Shared pool"", ""Standalone high chair - always at the listing"", ""Kitchen""]",$525.00,3,365,3,7,1125,1125,3.2,1125.0,,t,25,55,85,154,2024-12-28,21,20,0,2023-11-27,2024-11-26,4.67,4.71,4.81,4.29,4.52,4.95,4.57,,t,22,22,0,0,1.58
963,1013823872242904086,https://www.airbnb.com/rooms/1013823872242904086,20241228025327,2024-12-28,city scrape,Beautiful seaport 2 bed 2 bath  1 king bed 2 twin,This unique place has a style all its own.,,https://a0.muscache.com/pictures/hosting/Hosting-1013823872242904086/original/a3586ef0-be90-4593-bf5a-bbe38d461e70.jpeg,163848078,https://www.airbnb.com/users/show/163848078,Adam,2017-12-23,"Boston, MA",,within an hour,94.0,78%,f,https://a0.muscache.com/im/pictures/user/169ae9df-ed9d-43f5-a36c-30fbe1d8ad4c.jpg?aki_policy=profile_small,https://a0.muscache.com/im/pictures/user/169ae9df-ed9d-43f5-a36c-30fbe1d8ad4c.jpg?aki_policy=profile_x_medium,Fenway–Kenmore,102,144,['phone'],t,t,,East Cambridge,,42.36971056912292,-71.07415878368238,Entire rental unit,Entire home/apt,5,2.0,2 baths,2.0,1.0,"[""Essentials"", ""Wifi"", ""Conditioner"", ""Carbon monoxide alarm"", ""Outdoor dining area"", ""Body soap"", ""Pets allowed"", ""Smoke alarm"", ""Bidet"", ""Hot water"", ""Dedicated workspace"", ""Hangers"", ""Central heating"", ""Dishes and silverware"", ""Shampoo"", ""Free dryer \u2013 In unit"", ""Cooking basics"", ""Air conditioning"", ""Washer"", ""TV"", ""Iron"", ""Exercise equipment"", ""Hair dryer"", ""Kitchen""]",$349.00,1,365,1,1,365,365,1.0,365.0,,t,30,60,90,303,2024-12-28,14,14,0,2024-06-15,2024-11-11,4.64,5.0,4.64,4.71,4.21,4.86,4.5,Str-068357,f,3,3,0,0,2.13
